url,title_list,author_list,time_list,content_list,tag_list
https://dongqiudi.com/articles/2130702.html,英格兰vs丹麦：凯恩一个顶俩，腰无力困扰三狮,刘强专栏,07-08 08:26,"['斯凯组合再建功，三狮军团击败丹麦，队史第二次跻身大赛决赛。在这场比拼耐心和意志的比赛中，三狮军团的中场运输线一度被对手切断，凯恩在逆境中展示出了全能身手和巨星风范，以身兼两职的方式带领球队走出困境，为索斯盖特连续通过变招并最终压垮对手奠定了基础。', '两支以阵容深度著称的球队会师于温布利，尤勒曼保留了1/4决赛阶段淘汰捷克时的首发阵容，索斯盖特则继续推动锋线和两翼的轮换。萨卡能够取代桑乔成为首发，一方面是得益于其轮休一场建立起的体能优势，另一方面就是他的防守贡献度较高，能够在必要的时候协助队友建构五后卫防线。', '在现场近6万名球迷的呐喊声中，英格兰改变了此前立足于中场绞杀的防守策略，开始尝试一些高位逼抢。然而，由于丹麦后场人数和出球点较多，英格兰的前场压迫并未起到很好的效果，单兵对抗强度不足、三线连接不够紧密（尤其是边锋和边卫之间）的漏洞反而被对手利用。若非沃克依靠速度优势连续救险，英格兰很可能更早地处于落后的局面。', '无法在前场夺得球权，英格兰在层层推进的过程中也遇到了麻烦。从小组赛阶段开始，英格兰便注重依靠边路球员间的连接完成推进，只有在两翼通道淤塞的时候，前场球员才会来到中圈弧附近襄助后场的队友。依靠边翼卫带来的宽度优势和球员们的积极跑动，丹麦能够以343切换541的方式覆盖场地空间，英格兰在拉开空间后无法从边路找到向前通道，双后腰与前场球员之间距离过大，菲利普斯和赖斯面对逼抢时多次送出球权。', '进入淘汰赛阶段以来，英格兰连续迎战三支使用三中卫/五后卫的球队。面对德国时，英格兰一度处于较为被动的局面，最终靠着凯恩的不断回撤要球才在中盘阶段组织起攻势。对阵乌克兰，索斯盖特恢复了前腰设置(变回四后卫)，同时又安排具备10号属性的桑乔首发，取得了对局面的绝对控制。', '此役，格拉利什未能首发，芒特的作用更多地体现在前场，顶替桑乔的萨卡更擅长在边路直上直下，凯恩不可能像对阵德国时那样长期“蛰伏”，也很难像对阵乌克兰时那样靠前站位等待队友传球，必须尽快以“前腰”身份来救援两名后腰。', '三名中卫很难跟防到较深的位置，两名后腰为边路的压力所牵绊，丹麦很难限制处于外围游击状态的凯恩，只能优先使用犯规来破坏他的节奏。除了在中场附近拿球引领同伴前插进攻，凯恩进入前场后的走位也很聪明，他会捕捉丹麦中卫与后腰之间的缝隙，也会利用德莱尼被吸引到边路的机会，连续在肋部区域送出威胁球。', '凯恩早早地摁下提速键，这意味着格拉利什必须尽快出场，完成与大英头牌的任务接力。就在索斯盖特换上格拉利什的同时，尤勒曼也换上进攻球员予以应对。波尔森出场后，丹麦能够以他为支点简化进攻组织，缓解防线的压力。', '局面僵持不下，索斯盖特的后续调整没有太多惊人之举，最大的亮点出在对亨德森的位置设定上。亨德森替换赖斯出场，三狮中场的调度球和后上冲击力得到了提升，其多次沿右路的压上助攻改变了双方在这一侧的力量对比，为斯特林的突破造点埋下了伏笔。', '作为相对强势且阵容深度更优的一方，索斯盖特只须循规蹈矩地祭出后招就能无限接近于胜利。尤勒曼的临场调整需要考虑地更多，复杂局面下的“急智”之举难免有值得商榷之处。早早地用掉全部换人名额，多尔贝格和德莱尼均未能参加加时赛，尤勒曼的变招最终导致了丹麦在最后时段陷入无力回天的境地。']","['丹麦', '英格兰', '斯特林', '哈里-凯恩', '索斯盖特']"
https://dongqiudi.com/articles/2130768.html,不知有多少人在欧洲杯开始前，能预测到...,大佬鸣的体育天地,07-08 08:21,['不知有多少人在欧洲杯开始前，能预测到英格兰和意大利最终会是决赛，不过从足球竞技的层面出发，这个结果绝对合理，看双方的晋级过程亦实至名归！这是两支成功进行更新换代的球队，阵容与过往有天翻地覆的变化，然而各自在新任主帅带领下迸发出强大的竞争力。一代新人换旧人，长江后浪推前浪，永远是竞技体育不可逆转的规律，这两支球队对此做得炉火纯青，会师决赛乃情理之中\n——这足够证明他们在青训层面的成功，大批青年才俊涌现可供选择，特别是英格兰，他们是目前世界范围内青训最好的国家，所以有这样的成绩不奇怪，中国足球对这支所谓的“欧洲中国队”，在这方面可真羡慕不来啊[捂脸]'],"['英格兰', '意大利']"
https://dongqiudi.com/articles/2130758.html,真香，德国裁判布里希得到英国媒体称赞,骆驼飞鸟鱼刺,07-08 08:10,"['德国队在本届欧洲杯很早被淘汰，留在本届欧洲杯的最后一个德国人是德国裁判布里希。布里希执法了意大利与西班牙的欧洲杯半决赛，布里希的执法得到了英国媒体的称赞。', '德国裁判布里希执法了意大利与西班牙的半决赛，他的执法得到了多家媒体的称赞。英格兰足坛名宿莱因克尔在个人主页中称赞布里希“一名伟大的裁判”。另外《泰晤士报》记者Winter也称赞布里希：“布里希的执法冷静、准确，如果他能留在伦敦就好了，希望能留下三四年。”', '之前布里希执法了英格兰4-0击败乌克兰的四分之一淘汰赛，当时赛前英格兰媒体担心，因为英格兰刚刚淘汰了德国，因此会被德国裁判布里希针对。现在因为布里希在执法意大利和西班牙比赛时的出色表现，英国媒体希望布里希能留在欧洲杯继续执法。不过布里希已经执法了半决赛，将不会执法决赛了。']","['英格兰', '德国']"
https://dongqiudi.com/articles/2130751.html,都回来了[拳头][拳头],南安普顿足球俱乐部,07-08 08:07,['都回来了[拳头][拳头]'],['南安普顿']
https://dongqiudi.com/articles/2130750.html,（Man United）你嘛时候欧洲第一啊？曼联...,eeeCstasy,07-08 08:07,['（Man United）你嘛时候欧洲第一啊？\n曼联官方更新社交媒体图片并配文，“古往今来，那些身披三狮战袍的曼联将士们。”\n在刚刚结束的英格兰和丹麦的比赛中，九十分钟双方1-1打平进入加时，三狮军团凭借着斯特林的造点，凯恩主罚被扑后再补射入网，绝杀丹麦，将与意大利会师决赛。\nThree lions. Past and Then\nManchester United（来源）\nhttps://www.manutd.com/SeeRed（地址）'],"['英格兰', '曼联']"
https://dongqiudi.com/articles/2130747.html,著名歌手谭咏麟早上5点41分更新社媒信息，谭校长...,天tian足球,07-08 08:03,['著名歌手谭咏麟早上5点41分更新社媒信息，谭校长昨晚熬夜看英格兰和丹麦的比赛了！关于他说的都说中了！[赞][赞][棒棒哒][棒棒哒]'],"['丹麦', '英格兰']"
https://dongqiudi.com/articles/2130745.html,新争议，英格兰得到点球前，球场上出现了两个球,骆驼飞鸟鱼刺,07-08 08:00,"['在今天凌晨结束的欧洲杯半决赛比赛中，英格兰通过加时赛2-1击败丹麦，进入欧洲杯决赛。比赛加时赛，英格兰得到的点球引发了外界的极大争议，同时德国媒体《图片报》发现，在点球判罚前还有新的争议，在斯特林进入丹麦禁区前，球场上出现了两个球。《图片报》评论，也许这个点球原本不应当出现。', '《图片报》发现了新争议，在斯特林进入对方禁区前，球场上出现了两个球。当时斯特林在右路突破，而就在他的跑动路线前方不远处，出现了第二个球。', '按照足球规定，如果干扰了比赛，球场上的第二个球必须要及时被清除，同时比赛要中断。当时丹麦的一名替补球员示意裁判球场上出现了第二个球，但是当值主裁没有做出行动，边裁也没有示意。', '之后斯特林突入禁区摔倒，裁判判罚了点球。']","['丹麦', '英格兰']"
https://dongqiudi.com/articles/2130744.html,疫情状态下温布利入场6万人，巴拉克：这肯定是个大问题,阿漂,07-08 07:57,"['德国媒体SPORTBUZZER消息，欧洲杯半决赛温布利进入了6万名球迷，赛事刚开始时伦敦只允许2万名球迷入场，德国传奇球星巴拉克认为这“很成问题”。', '在英格兰与丹麦的比赛前，巴拉克对MagentaTV说：“在欧洲杯进行的过程中，再一次提高入场的观众人数，这肯定是会成问题的。现在入场的人实在是太多了。”', '欧洲疾控中心在此前披露，与欧洲杯相关联的新冠感染人数呈明显上升态势。在欧洲杯进行了三个星期后的数据显示，在七个与欧洲杯相关联的国家中，收到了超过2500例新病例报告。']","['英格兰', '巴拉克']"
https://dongqiudi.com/articles/2130743.html,丹麦演员瓦尔道：英格兰配得上胜利，但VAR应该被废除,桐谷爱丽丝,07-08 07:56,"['《权力的游戏》主演瓦尔道在社交媒体上表示，英格兰配得上欧洲杯半决赛的胜利，但VAR应该被废除。', '丹麦演员瓦尔道因在《权力的游戏》中出演詹姆-兰尼斯特一角而闻名，他本人也很关注祖国在欧洲杯上的比赛，在对阵英格兰的半决赛结束后，他更新社交媒体表示：“英格兰配得上胜利，但这是我们摆脱VAR的又一个原因。”', '“如果VAR无法在欧洲杯半决赛纠正一个关乎到比赛胜利的错误点球的话，那么保留这项技术又有什么意义呢。”', '“再次祝贺英格兰的胜利，但Fxxk VAR。”']","['丹麦', '英格兰']"
https://dongqiudi.com/articles/2130737.html,Troll Football：恶搞斯特林对阵丹麦...,曼城球迷协会,07-08 07:50,['Troll Football：恶搞斯特林对阵丹麦的比赛热图'],"['丹麦', '曼城', '斯特林']"
https://dongqiudi.com/articles/2130736.html,欧洲杯半决赛我锤球员表现：-赖斯：本场比赛大米继...,麦子CC,07-08 07:49,['欧洲杯半决赛我锤球员表现：\n\n-赖斯：本场比赛大米继续代表英格兰首发，出场95分钟，在对抗方面大米表现的并不是特别好，但是他在防守端的其他表现还是可圈可点。本场比赛他贡献1次解围，3次断球，1次铲断和2次过人，传球成功率也有95%。最终英格兰通过加时赛2:1击败丹麦，顺利进入决赛。'],['西汉姆联']
https://dongqiudi.com/articles/2130735.html,吐槽个球丨欧洲杯半决赛，英格兰加时2-1战胜丹麦...,Laoshu,07-08 07:48,['吐槽个球丨欧洲杯半决赛，英格兰加时2-1战胜丹麦进入决赛。加时赛中，斯特林造点引发争议。\n\n其一，斯特林这次倒地除了有假摔嫌疑外，他倒地前场内有2个足球，丹麦替补球员的提醒被边裁无视。\n\n其二，斯特林到底是不是假摔？球员为了球队利益可以理解，各大球星都这么干过，但是这次有var，明明都有提示了为什么不去看呢？着实让人感到不公平。'],"['丹麦', '英格兰']"
https://dongqiudi.com/articles/2130730.html,英格兰和丹麦这场比赛的主裁判丹尼-马克列已经不是...,D站米兰哥,07-08 07:43,['英格兰和丹麦这场比赛的主裁判丹尼-马克列已经不是第一次因为争议判罚成为赛后的主角了，上一次应该也有很多人记得……[看不下去]'],"['丹麦', '英格兰', '葡萄牙', 'C罗']"
https://dongqiudi.com/articles/2130729.html,（espn）蜜汁操作？斯特林在加时赛中为英格兰赢...,eeeCstasy,07-08 07:43,['（espn）蜜汁操作？\n斯特林在加时赛中为英格兰赢得点球时，球场上似乎还出现了第二个球。\n英格兰队就是凭借着这粒点球，二比一绝杀丹麦。\nThere appeared to be a second ball on the pitch during the play that Raheem Sterling won a penalty for England in extra time.\nESPN（来源）\nhttps://plus.espn.com/（地址）'],"['丹麦', '英格兰', '曼城', '斯特林']"
https://dongqiudi.com/articles/2130728.html,大心脏！舒梅切尔扑出凯恩点球前，还遭激光笔照射干扰,这就是足球儿,07-08 07:42,[],"['丹麦', '英格兰', '卡斯帕-舒梅切尔']"
https://dongqiudi.com/articles/2130726.html,“童话军团”虽败犹荣！感受丹麦球迷风采，英格兰大叔是亮点,足球放送,07-08 07:40,[],"['丹麦', '英格兰']"
https://dongqiudi.com/articles/2130720.html,欧洲杯半决赛：英格兰加时赛点杀丹麦晋级决赛，会师意大利,播报员周瑜,07-08 07:34,"['欧洲杯半决赛在温布利展开较量：英格兰在有主场优势得情况下和丹麦战至加时赛，哈里凯恩利用点球机会决赛丹麦晋级决赛。将和意大利争夺本届欧洲杯冠军奖杯。', '本届欧洲杯达姆斯高非常耀眼，今天他的一脚任意球世界波向世人展示了完美电梯球的定义，也帮助丹麦上半场一度领先，可惜在上半场克亚尔的乌龙球帮助英格兰扳平了比分，至此双方展开了焦作战，均未能在90分钟内进球打成了1-1，加时赛斯特林禁区里被放倒，裁判果断给了点球，哈里凯恩一蹴而就绝杀丹麦。最终英格兰终结了丹麦的童话故事。欧洲杯最大黑马也就此落幕。最终的决战意大利-英格兰谁会成为最终的王者，咱们决赛见！记得给周瑜点点关注哦！']","['丹麦', '英格兰', '斯特林', '哈里-凯恩', '米克尔-达姆斯高']"
https://dongqiudi.com/articles/2130725.html,丹麦门将遭激光笔射眼 欧洲杯 今天凌晨的...,足球大会,07-08 07:33,"['今天凌晨的欧洲杯半决赛中，英格兰淘汰丹麦，“童话”破没的同时，足球也回了家。', '不过，这场比赛却充满争议，除了斯特林造点被批跳水之外，凯恩罚点球时，现场直播还捕捉到看台上有人用激光笔直射门将小舒梅切尔的眼睛。', '赛后，为丹麦喊冤的球迷不在少数，外网有人直说英格兰赢球的“吃相难看”。']","['丹麦', '莱斯特城', '卡斯帕-舒梅切尔']"
https://dongqiudi.com/articles/2130718.html,21/22 曼城门将球衣,曼城球迷协会,07-08 07:30,['21/22 曼城门将球衣'],['曼城']
https://dongqiudi.com/articles/2130717.html,欧洲杯-丹麦两球，凯恩点失，英格兰仍胜丹麦进决赛,Charlesdn,07-08 07:30,"['矿工看足球之欧洲杯日报 0708第二十一期', '童话破灭非悲剧，丹麦昂首骄傲凯旋；', '凯恩补点立首功，三狮坐等罗马军团。', '昨日赛报', '英格兰2:1丹麦', '今天凌晨，欧洲杯半决赛结束了第二场的争夺。由英格兰对阵丹麦，90分钟双方战成1:1平，加时赛中凯恩点球被扑，自己补射破门，将比分锁定在2:1。最终英格兰意大利会师决赛。下面带来详细报道。', '这场比赛在温布利球场举行，有着主场优势的英格兰对阵超级黑马丹麦。面对强大的英格兰，丹麦队丝毫不怯场，反而在第29分钟凭借米克尔-达姆斯的一记超远距离直接任意球破门，反客为主领先英格兰。', '第38分钟，凯恩直塞球直插丹麦身后，萨拉传中，斯特林抢点未果，却造成丹麦队克亚尔的乌龙。英格兰将比分扳平。', '90分钟结束，双方均未再取得进球，比赛进入加时赛。', '加时赛第12分钟，斯特林禁区内过人被绊倒，英格兰获得点数。凯恩主罚右路被丹麦门将扑出，之后自己补射入网，英格兰2:1战胜丹麦，与意大利会师决赛。或许，凯恩应该感谢，这不是点球大战。', '比赛预告', '四天之后，欧洲杯将迎来最终的高潮。意大利和英格兰会师决赛，究竟是足球回家，英格兰时隔多年再次夺冠，还是意大利重回巅峰，捍卫亚平宁荣光，这场焦点战值得期待。具体比赛时间如下：（以下时间均为北京时间）', '7月12日 03:00 意大利Vs 英格兰', '（图片来自懂球帝，版权归懂球帝所有）']","['英格兰', '曼城', '托特纳姆热刺', '斯特林', '哈里-凯恩']"
https://dongqiudi.com/articles/2130713.html,英格兰与丹麦一战中，一位英格兰球迷买错了门票！孤...,北伦敦小酒馆,07-08 07:28,['英格兰与丹麦一战中，一位英格兰球迷买错了门票！\n孤岛英雄！'],['英格兰']
https://dongqiudi.com/articles/2130710.html,比赛集锦：英格兰加时2-1丹麦,绿茵绿茵,07-08 07:26,['\n'],"['丹麦', '英格兰']"
https://dongqiudi.com/articles/2130708.html,彪马与Madchester品牌合作发布的特别版曼...,曼城球迷协会,07-08 07:23,['彪马与Madchester品牌合作发布的特别版曼城球衣曝光。'],['曼城']
https://dongqiudi.com/articles/2130707.html,前意甲裁判：裁判认为延森犯规了，但斯特林是在跳梅勒的水,桐谷爱丽丝,07-08 07:23,"['前意甲裁判Tiziano Pieri在《Rai》电视节目上表示，裁判认为丹麦的延森对斯特林有犯规动作所以判罚点球，但实际上斯特林只是假装与身后的梅勒有接触然后跳水。', '在对阵丹麦的欧洲杯半决赛中，英格兰在加时赛拿到了一个极具争议的点球。', '对此，意大利电视台的裁判专家兼前意甲裁判Tiziano Pieri表示：“当时英格兰的进攻路线上似乎有两个球非常接近，如果是这样的话，助理裁判理应向裁判示意吹停比赛。”', '“不过，对于我来说，我觉得那看起来不像是一个皮球，而是一个停在球场上的气球，它的形状比球更细长一些。”', '“至于点球，当值主裁判很有可能是吹延森的屁股对斯特林犯规了，但在这之前，斯特林已经处于跳水的状态，而VAR通过无声的检查确认了裁判的判罚。”', '“在我看来，这不是一粒点球，因为在延森碰到斯特林之前，后者就已经处于跳水的状态了，他假装自己与身后的梅勒有过接触，但实际上并没有接触。”']","['丹麦', '英格兰', '布伦特福德', '曼城', '亚特兰大', '斯特林', '马蒂亚斯-延森', '梅勒']"
https://dongqiudi.com/articles/2130695.html,队报：拜仁、曼联、巴黎、皇马和切尔西都想要卡马文加,阿漂,07-08 07:10,"['法国媒体《队报》消息，目前有多家欧洲豪门问价卡马文加，其中就包括拜仁。', '据了解，包括曼联、巴黎、皇马、切尔西和拜仁在内的俱乐部都询问了卡马文加的情况。', '卡马文加看起来不会与雷恩续约。不过截止到目前还没有收到正式的报价。《队报》表示，以目前的激烈竞争来看，卡马文加的转会费将会达到4000万欧元。']","['拜仁慕尼黑', '巴黎圣日耳曼', '雷恩', '曼联', '皇家马德里', '切尔西', '卡马文加']"
https://dongqiudi.com/articles/2130686.html,赖斯：对决赛做好了准备，希望和主场的球迷们一起欢呼庆祝,RLD_Erfolg,07-08 07:01,"['英格兰在120分钟比赛后击败了丹麦，挺进欧洲杯决赛。中场球员德克兰-赖斯在赛后表示心情很激动，他自己在这时也是一名球迷，他希望在决赛时和球迷们一起欢呼。', '赖斯说：“是时候取得比世界杯更好的成绩了。我现在非常激动。”', '“如果低估对手，我们就错了。但凭借我们的实力，我们知道最终可以击败他们。这是我们面对的第一个丢球，你要做一下深呼吸，不要得意忘形。”', '“这是我们自1966年之后的第一场决赛。我非常想为主场的球迷们做到这件事。我看到了他们的反应，我自己也是一名球迷。我希望我和他们一起欢呼，我们现在还没有赢下任何东西，意大利非常强，但我们准备好了。”', '“就在第二个球打进时，我哥哥的孩子出生了，是一个女孩，这真的是一个特别的夜晚。”']","['英格兰', '西汉姆联', '德克兰-赖斯']"
https://dongqiudi.com/articles/2130685.html,克拉滕伯格：丹麦队会抗议点球判罚，但这不是明显的错误,Gambino,07-08 07:00,"['荷兰裁判马克列在欧洲杯半决赛判给英格兰队点球，克拉滕伯格认为这不是明显的误判。', '英格兰队遇到两个和点球有关的事件：一次获得点球，一次则没有。', '第一次和点球有关的事件，替补球员诺尔高在凯恩身前，凯恩当时获得球权(然后被绊倒)，但裁判没有判罚点球，我不认为这是可以被改判的明显错误。', '至于斯特林的那次点球判罚，梅勒和斯特林有轻微接触。在如此关键的时刻，我不认为这样的抢断让裁判有充分理由判罚点球，丹麦队会抗议这次判罚非常严厉，但我还是要说这不是一次明显的误判。', '卢克-肖对克里斯滕森有明显犯规，因此，马克列给丹麦队任意球是正确的判罚，我相信英格兰球迷不会对此满意，但马克列在人群中很好地识别出这次犯规。']","['英格兰', '曼城', '斯特林', '克拉滕伯格']"
https://dongqiudi.com/articles/2130684.html,阿尔托贝利：给意大利一个英格兰这样的点球，英媒会讨论一年,桐谷爱丽丝,07-08 07:00,"['意大利名宿阿尔托贝利在《Rai》电视节目上表示，如果意大利拿到一个像英格兰对阵丹麦时那样的点球的话，英国媒体会讨论整整一年。', '在对阵丹麦的欧洲杯半决赛中，英格兰在加时赛拿到了一个极具争议的点球，目前许多足坛名宿都发声认为这不是一粒点球，意大利传奇前锋阿尔托贝利也是如此。', '阿尔托贝利嘲讽了当值主裁麦克利的判罚，他表示：“如果他们给我们一粒像英格兰这样的点球的话，英国的报纸会讨论它整整一年。”']","['丹麦', '英格兰', '意大利', '阿尔托贝利']"
https://dongqiudi.com/articles/2130683.html,英格兰2-1丹麦  闯入欧洲杯决赛,OB法兰西之夜,07-08 07:00,[],"['卡斯帕-舒梅切尔', '斯特林', '哈里-凯恩', '米克尔-达姆斯高', '布卡约-萨卡']"
https://dongqiudi.com/articles/2130682.html,英格兰丹麦的半决赛，又一次是按照剧本来走：90分...,林本剑,07-08 07:00,['英格兰丹麦的半决赛，又一次是按照剧本来走：90分钟打平，加时赛英格兰如愿进入决赛。今年的决赛会不会重演上一届的一幕：东道主被干翻。毕竟，英格兰实力强，又是主场，夺冠赔率低。2004年和2016年欧洲杯决赛，两个东道主葡萄牙和法国都输了给实力弱的一方。\n提前预测一下决赛：90分钟还是打平，后面的加时赛以及可能的点球大战，看意英两队各自造化吧！'],['英格兰']
https://dongqiudi.com/articles/2130658.html,杜蕾斯早报：顺“英”民意,绿鱼绿,07-08 07:00,"['大家早上好，欢迎收看7月8日的懂球帝早报。', '【剑南春丨欧洲杯战报：英格兰2-1丹麦晋级决赛，凯恩加时制胜】', '\n', '【阿根廷点球胜哥伦比亚晋级决赛对阵巴西，马丁内斯三扑点球】', '【官宣了但没完全官宣，巴黎官网的拉莫斯加盟新闻已删除】', '【进球功臣，凯恩当选英格兰vs丹麦一役欧洲杯官方最佳球员】', '【斯特林谈点球：对方球员把腿伸出来了，进球才重要】', '【温格谈斯特林造点：这不是点球，裁判应该去看一下回放】', '【德国裁判专家：欧洲杯半决赛不能这样草率判点球】', '【阿斯报嘲讽斯特林：恭喜加入英国奥运跳水队】', '【本届欧洲杯第11粒乌龙球，欧洲杯历史乌龙球已突破20大关】', '【英格兰队史首次晋级欧洲杯决赛，时隔55年再进大赛决赛】', '【巴萨官方就登贝莱&格列兹曼不当行为道歉：对种族歧视零容忍】', '【KONAMI官方：取消格列兹曼的代言合同，并要求巴萨作出解释】', '【继续追逐国家队的冠军，梅西第5次代表阿根廷闯入大赛决赛】', '【官方：前拜仁中场哈维-马丁内斯正式加盟卡塔尔体育】', '【国际足联公布中国女足奥运大名单：王霜领衔，娄佳惠落选】', '【武磊、颜骏凌和王燊超回到崇明岛基地，看望恩师徐根宝】', '【国足与足协工作组行将解除隔离，下一步工作重心为备战12强赛】', '22:00 亚冠小组赛 北京国安vs联城']","['丹麦', '英格兰', None, None, None, None, None]"
https://dongqiudi.com/articles/2130680.html,凯恩：难以置信的表现，我们闯进了欧洲杯决赛，温布利太棒了,ETChalmers,07-08 06:58,"['欧洲杯半决赛，英格兰经历加时赛2-1逆转击败丹麦，晋级决赛，此役打入关键制胜球的凯恩赛后更新个人社交媒体庆祝晋级。', '此役对阵丹麦，凯恩在加时赛上半场主罚点球被扑，随即补射得手，帮助英格兰2-1逆转取胜，实现队史首次闯进欧洲杯决赛。', '赛后，凯恩更新个人社交媒体庆祝晋级，写道：“哇，这个夜晚太美妙了，难以置信的表现，我们闯进了欧洲杯决赛，温布利太棒了！”']","['英格兰', '托特纳姆热刺', '哈里-凯恩']"
