url,title_list,author_list,time_list,content_list,tag_list
https://dongqiudi.com/articles/2133745.html,阿森纳官宣，小将奥孔科沃提拔至一线队,足球放送,07-09 23:08,['阿森纳官宣，小将奥孔科沃提拔至一线队'],"['阿森纳', '阿森纳U23', '奥孔科沃']"
https://dongqiudi.com/articles/2133735.html,2021/22赛季，南安普顿第二客场球衣,足球放送,07-09 23:03,['2021/22赛季，南安普顿第二客场球衣'],['南安普顿']
https://dongqiudi.com/articles/2133733.html,比利时媒体：多特、曼城、巴黎、巴萨争夺安德莱赫特15岁小将,阿漂,07-09 23:02,"['德国媒体sport.de援引自比利时媒体Het Nieuwsblad消息，多特蒙德参与到了比利时新星Rayane Bounida的争夺战中。', '据悉，对15岁的Rayane Bounida感兴趣的球队很多，其中包括曼城、巴黎和巴塞罗那这三支欧洲豪门。', '球员目前效力于安德莱赫特，尽管还没有签订职业合同，俱乐部还是希望能留下他。相比那些对他感兴趣的大俱乐部，安德莱赫特可以提供更好的职业生涯规划。', 'Rayane Bounida司职进攻型中场，被视为天才球员。']","['巴黎圣日耳曼', '多特蒙德', '曼城', '安德莱赫特', '巴塞罗那']"
https://dongqiudi.com/articles/2133732.html,伊朗7岁小神童阿拉特，最近又展现出了他的精湛球技,ForzaBan,07-09 23:02,['正在利物浦青训学院接受训练的伊朗7岁小神童阿拉特(Arat Hosseini)，最近又展现出了他的精湛球技?'],['利物浦']
https://dongqiudi.com/articles/2133725.html,跟队记者：水晶宫1200万镑报价恩凯蒂亚被拒，枪手要价2500万,ETChalmers,07-09 22:59,"['上赛季，恩凯蒂亚代表阿森纳在各项赛事出场29次，打入6球并送出1次助攻，这位22岁的英格兰前锋与枪手的现有合同将于2022年夏天到期。', '报道称，水晶宫已就求购恩凯蒂亚向阿森纳提交了一份1200万镑的报价，但已被阿森纳拒绝，阿森纳想要2000万欧外加500万镑浮动条款。', '该记者表示，不觉得水晶宫会满足阿森纳的要价。']","['阿森纳', '水晶宫', '恩凯蒂亚']"
https://dongqiudi.com/articles/2133752.html,Troll Football这个太绝了……#欧洲...,足球大会,07-09 22:58,['Troll Football这个太绝了……\xa0'],"['英格兰', '意大利']"
https://dongqiudi.com/articles/2133720.html,Moment | 快看看这性感的翘臀,Dr_Football,07-09 22:54,['Moment | 快看看这性感的翘臀'],"['英格兰', '斯特林']"
https://dongqiudi.com/articles/2133718.html,富勒姆队新任主教练马尔科-席尔瓦带队首训。席尔瓦...,布叔,07-09 22:52,['富勒姆队新任主教练马尔科-席尔瓦带队首训。席尔瓦曾执教过埃弗顿、沃特福德、葡萄牙体育等俱乐部。在2019年被埃弗顿队解雇。'],"['富勒姆', '马尔科-席尔瓦']"
https://dongqiudi.com/articles/2133712.html,It’s coming home | 品牌 : ...,Dr_Football,07-09 22:50,['It’s coming home | 品牌 : talismancaps'],[]
https://dongqiudi.com/articles/2133702.html,曼晚：有消息说曼城1亿镑报价凯恩；蓝月亮和热刺都不承认,自赫,07-09 22:42,"['据《曼彻斯特晚报》的消息，有传言表示曼城曾以1亿英镑的价格报价凯恩。', '《曼晚》方面询问了他们在曼城的消息源，该消息人士表示曼城没有为凯恩送出过报价。《曼晚》方面也询问了他们在热刺的消息源，得到的回复同样是热刺方面没有收到到过曼城引进凯恩的报价。', '即便如此，《曼晚》方面的一个消息源(该消息源既不来自曼城方面，也不从属于热刺方面)表示，曼城曾为引进凯恩而向热刺送上了1亿英镑的报价。由于目前欧洲杯还在打，英格兰队如今也已经进入到了决赛，因此曼城在送出这份报价时是低调行事，他们不希望对哈里-凯恩造成打扰。', '在曼城方面得知他们为凯恩送上1亿英镑报价的事情被曝光了出来之后，蓝月亮方面感到很不高兴。']","['曼城', '托特纳姆热刺', '哈里-凯恩']"
https://dongqiudi.com/articles/2133682.html,苏格兰媒体ThesecretScout：关于哈兰...,天tian足球,07-09 22:26,['苏格兰媒体ThesecretScout：关于哈兰德，切尔西仍在努力达成协议，希望可以在今夏敲定，毕竟明年夏天有其他俱乐部竞争。\n\n多特蒙德没有卖人的压力，目标是多留一赛季，佐尔克和拉伊奥拉关系很好。\n\n希望找到理想的替代者，如果没有，交易不可能。 \n\n\n｜信息来源参考：ThesecretScout推特社交媒体'],"['多特蒙德', '切尔西', '哈兰德']"
https://dongqiudi.com/articles/2133681.html,非洲球员历史转会费排行：佩佩居首，阿什拉夫并列第五,大风车keith,07-09 22:26,"['德国转会市场网站盘点了非洲球员历史转会费排行榜，阿森纳前锋佩佩以8000万欧居首，刚刚转投巴黎的阿什拉夫以6000万欧转会费并列第五。', '1、尼古拉-佩佩：8000万欧', '2、奥斯梅恩：7000万欧', '3、马赫雷斯：6780万欧', '4、奥巴梅扬：6380万欧', '5、纳比-凯塔：6000万欧', '5、阿什拉夫：6000万欧', '7、阿莱：5000万欧', '7、托马斯-帕尔特伊：5000万欧', '9、萨拉赫：4200万欧', '10、马内：4120万欧']","['阿森纳', '巴黎圣日耳曼', '马赫雷斯', '萨拉赫', '马内', '奥巴梅扬', '阿莱', '纳比-凯塔', '托马斯-帕尔特伊', '尼古拉-佩佩', '奥斯梅恩', '阿什拉夫']"
https://dongqiudi.com/articles/2133679.html,穆里尼奥：我认为凯恩很可能会留在热刺，列维不会放他走,剪翻足球,07-09 22:24,[],"['罗马', '托特纳姆热刺', '哈里-凯恩', '穆里尼奥']"
https://dongqiudi.com/articles/2133675.html,ESPN：枪手没有欧战资格，但奥亚尔不会因此排除加盟的可能性,自赫,07-09 22:23,"['据ESPN的消息，在新赛季中，阿森纳是没有欧战资格的，但是并不是说奥亚尔会因为这个原因而去排除加盟阿森纳的可能性。', '在2020年的夏天，对于奥亚尔，里昂方面的要价是6000万欧元，然而在现在，奥亚尔加盟阿森纳的价格可能是2000万英镑，即2330万欧元。由于全球范围内严重的新型冠状病毒肺炎疫情，导致了全球经济的严重萎靡和国际贸易的停滞。', '在这个夏窗，阿森纳主帅阿尔特塔希望引进一名具有创造力的中场队员。在去年夏天，在整个的转会窗开启期间，似乎都在流传着奥亚尔将加盟阿森纳的传言。现在相比于去年夏天，枪手引进奥亚尔的成本已经降低了很多。当然据悉在引进奥亚尔之前，枪手方面需要先出售队中的队员。ESPN和罗马诺都有过这样的表述。', '在采访中，奥亚尔表示，在里昂队，他获得了很大的空间和自由度。奥亚尔说，在左路踢球，能够让他依靠自己的个人能力，去制造出更多的闪光点、更多的不同，当然在踢中路的时候，自己也是可以去改变比赛的。奥亚尔理想中的球队，是一支能够给予他很高自由度的球队。']","['阿森纳', '里昂', '奥亚尔']"
https://dongqiudi.com/articles/2133673.html,意媒：热刺即将与博洛尼亚就富安健洋达成协议,洛塞尔索天下第一,07-09 22:22,"['据博洛尼亚当地媒体 Corriere\xa0di\xa0Bologna 报道，托特纳姆热刺和博洛尼亚即将就富安健洋的转会达成协议。', '据该报道声称，热刺已经为这位后卫进行了第二次报价，价格为1900万欧元加奖金，非常接近博洛尼亚2000万欧元的最低要价。', '而根据此前媒体的报道，热刺与这位日本后卫就个人条款已经达成一致，球员本人也非常希望加盟这支北伦敦球队。另外有消息表示，热刺也在考虑塞维利亚中卫孔德和里昂外租中卫约西姆安德森。']","['博洛尼亚', '托特纳姆热刺', '富安健洋']"
https://dongqiudi.com/articles/2133662.html,切尔西训练场上的精彩进球，凯帕、卡巴屡成背景板,切尔西遇上巴萨,07-09 22:14,[],['切尔西']
https://dongqiudi.com/articles/2133657.html,福登的成长进化史,朋Zi远方,07-09 22:13,['福登的成长进化史'],"['曼城', '福登']"
https://dongqiudi.com/articles/2133652.html,克洛普：我的父亲之前就经常跟我说，无论之后人们怎...,侃球的欧豆豆,07-09 22:11,['克洛普：我的父亲之前就经常跟我说，无论之后人们怎样评价贝利，他一直都是有史以来最好的球员。事实上我在2006年世界杯期间作为特邀嘉宾见过贝利，说实话，我平时是一个遇事不慌的人，但是在那一刻我紧张到疯狂冒汗。\n新闻来源：https://www.instagram.com/p/CRGg4rbgdsB/?utm_medium=copy_link'],"['利物浦', '克洛普', '贝利']"
https://dongqiudi.com/articles/2133645.html,阿诺德晒照向球迷提问：这头发是留着还是剪了好？,大风车keith,07-09 22:07,"['日前，利物浦后卫阿诺德在社交媒体上晒出了自己的照片，并就自己的发型向球迷们进行了提问。', '阿诺德写道：“这头发是留着还是恢复成以前那样？”照片中，阿诺德留着脏辫，这与他在球迷心中往常的形象大相径庭。', '阿诺德上赛季的助攻数据较此前两个赛季有所下滑，由于伤病困扰，他在最后时刻无缘本届欧洲杯。', '而在评论区中，他的队长和好搭档亨德森、罗伯逊都很快做出了回复：“这不是废话嘛？赶紧的！”此外还有大部分球迷也都表达了相同的看法。']","['利物浦', '亨德森', '罗伯逊', '亚历山大-阿诺德']"
https://dongqiudi.com/articles/2133632.html,知名记者Angelo Mangiante：赖斯和...,天tian足球,07-09 21:57,['知名记者Angelo Mangiante：赖斯和哈兰德仍然是切尔西这个夏天转会窗的主要目标 。\n\n\n｜信息来源参考：Angelo Mangiante推特社媒'],"['多特蒙德', '切尔西', '西汉姆联', '德克兰-赖斯', '哈兰德']"
https://dongqiudi.com/articles/2133630.html,官方：阿森纳与年轻门将奥孔科沃续约，新赛季他将升入一线队,Brucewhm,07-09 21:57,"['阿森纳官方宣布，球队与19岁门将奥孔科沃续签了一份多年合约，他将在新赛季升入一线队。', '奥孔科沃出身于阿森纳青训，从U9阶段就一直为枪手效力。上赛季他定期和一线队一起训练，并在赛季期间多次作为球队第三门将随队出征，此外他还在青年英超联赛和英锦赛共出场8次。', '阿森纳技术总监埃杜表示：“青训学院的工作和一线队年轻球员的发展是我们俱乐部的重要组成部分，青训方面在近年来培养了一些顶级球员，并且都与俱乐部和球迷之间有着特殊的联系。”', '“我们有了从球队青训成长起来的第三门将，这真是太棒了，我们期待看到更多年轻球员的到来。奥孔科沃一直都在努力工作，我们相信他会有一个令人兴奋的未来。”', '主帅阿尔特塔则说道：“我们欢迎奥孔科沃加入一线队，很高兴又有一名青训球员通过我们的青训系统来到球队。能拥有他的巨大天赋和努力，我们要感谢青训学院的同事们把奥孔科沃培养到这个阶段，他们在球员发展方面做了伟大的工作，他们应该感到非常自豪。”', '“上个赛季奥孔科沃和一线队一起训练和出征了很多次，我们都亲眼看到了他的能力，他是一名很有潜力的年轻门将，我们很高兴他和球队签下了一份新合同，他已经在一线队中为自己赢得了一席之地。”', '“他现在每天都会和我们一起训练，我们期待着看到他继续发展和提高作为门将的能力，我知道我们所有的球迷都会和我一起祝贺他在职业生涯中迈出了积极的一步。”']","['阿森纳', '阿尔特塔', '埃杜', '阿森纳U23', '奥孔科沃']"
https://dongqiudi.com/articles/2133627.html,维拉蒂：我不会判给英格兰那个点球，那是很大方的一个点球！,剪翻足球,07-09 21:56,[],"['英格兰', '意大利', '巴黎圣日耳曼', '维拉蒂']"
https://dongqiudi.com/articles/2133618.html,英媒：曼联想要凯恩，热刺要价1亿英镑+2名红魔一线队球员,大风车keith,07-09 21:50,"['据Football Insider的报道，曼联想要引进凯恩，而热刺要价为1亿英镑现金外加2名红魔一线队球员。', '报道称，曼联正在努力推动签下凯恩，他们愿意花费大价钱引进英格兰队长。', '按照该报道的说法，热刺在最近几次沟通中的态度让红魔坚定了签下凯恩的想法，列维的球队想要1亿英镑现金外加2名红魔一线队球员。虽然热刺对外表态凯恩是非卖品，但事实上，他们可以接受1.5亿英镑的报价。']","['曼联', '托特纳姆热刺', '哈里-凯恩']"
https://dongqiudi.com/articles/2133601.html,深夜访谈你对新赛季球衣的期待是：_______,纽卡斯尔联足球俱乐部,07-09 21:36,['深夜访谈\n\n你对新赛季球衣的期待是：_______'],['纽卡斯尔联']
https://dongqiudi.com/articles/2133600.html,足球言论丨英超射手麦克阿文尼接受媒体Footba...,Laoshu,07-09 21:34,['足球言论丨英超射手麦克阿文尼接受媒体Football Insider的采访，谈到了热刺前锋凯恩的未来，麦克阿文尼指出，从凯恩与斯特林、福登搭档时的发挥来看，曼城并不是适合他的球队。\n\n“凯恩确实在欧洲杯中取得了进球，但前几场比赛里他一无所获，当时他与斯特林、福登两名曼城球员在锋线搭档。不要误会我的意思，他无论去哪里都会进球，但我不确定曼城是否适合他。”\n\n“福登没有为凯恩提供任何支持，而当时在场上进球的是斯特林，也许这对凯恩是一个警示。”\n\n言下之意就是曼城不适合哈里凯恩！'],"['曼城', '托特纳姆热刺', '哈里-凯恩']"
https://dongqiudi.com/articles/2133589.html,Hummel x 埃弗顿2021/22赛季主场球...,SPACEFOOTBALL,07-09 21:29,['Hummel x 埃弗顿2021/22赛季主场球衣发布'],['埃弗顿']
https://dongqiudi.com/articles/2133586.html,意媒：国米租借+强制买断引进贝莱林？枪手对此持开放态度,自赫,07-09 21:27,"['据意大利媒体报道，如果说有俱乐部想要以租借加强制买断的方式引进贝莱林，那么对此枪手持开放态度。', '据悉此前国米希望以租借加选择性买断的方式引进贝莱林，枪手方面是拒绝这种方式的。枪手方面和国米方面重启了关于贝莱林的谈判。对于贝莱林，枪手方面的要价是2000万欧元，国米认为这个价格太高了。', '《米兰体育报》和FC Inter 1908给出的消息基本是一致，它们都表示阿森纳对于让贝莱林离队持开放性态度，但前提是买方直接支付转会费或者是以租借加强制买断的方式引进他，枪手是不接受租借加选择性买断的。', '枪手允许贝莱林以租借加强制买断的方式离队，总的来说，这对于国际米兰是一个积极的消息，国米方面可能是愿意接受这种方式的。此前阿什拉夫加盟巴黎圣日耳曼的转会得到了官宣，现在国米方面需要重新去引进一名右后卫，这一点是很清楚的。贝莱林在国米的引援计划中，而且在国际米兰右后卫引援候选名单中，西班牙飞翼是处于一个比较靠前的位置。', '有媒体指出，假如枪手是以租借加强制买断的方式送走贝莱林，那么在一年以后贝莱林的买断费用会在2000万欧元至2500万欧元之间。国米的目标不止是贝莱林，有消息表示，国米也在考察切尔西的扎帕-科斯塔。还有消息表示国米希望从埃因霍温引进邓弗里斯。']","['阿森纳', '国际米兰', '贝莱林']"
https://dongqiudi.com/articles/2133585.html,镜报：卡西利亚希望重返西甲，他想加盟埃尔切,大风车keith,07-09 21:27,"['据《镜报》的报道，利兹联门将卡西利亚希望重返西甲，并加盟埃尔切。', '报道称，卡西利亚上赛季只为利兹联出场5次，这名34岁的西班牙门将希望获得更多的出场时间，因此他想以先租后买的方式加盟埃尔切。', '该报道透露，埃尔切愿意承担卡西利亚的部分工资，如果这一交易成为现实，卡西利亚也将与此前两地分居的家人团聚。', '据悉，利兹联总监Victor Orta将寻找一名年轻的门将，以替代卡西利亚。此外，Victor Orta还希望为利兹联补强中前卫和边锋位置。']","['利兹联', '埃尔切', '卡西利亚']"
https://dongqiudi.com/articles/2133576.html,足球言论丨贝尔巴托夫：“卡尔文·菲利普斯是欧洲杯...,Laoshu,07-09 21:20,['足球言论丨贝尔巴托夫：“卡尔文·菲利普斯是欧洲杯最佳球员之一，我希望他离开利兹联去一家更大的俱乐部。我希望看到他与曼联签约。”\n\nhttps://twitter.com/football__tweet/status/1413449098183659523?s=21'],"['英格兰', '利兹联', '卡尔温-菲利普斯']"
https://dongqiudi.com/articles/2133574.html,442高歌回顾英格兰进军决赛，足球回家了！,剪翻足球,07-09 21:18,[],"['丹麦', '英格兰', '托特纳姆热刺', '哈里-凯恩', '索斯盖特']"
https://dongqiudi.com/articles/2133567.html,足球动态丨利物浦球员阿诺德更新个人社交媒体帐号，...,Laoshu,07-09 21:13,['足球动态丨利物浦球员阿诺德更新个人社交媒体帐号，他向粉丝们征求意见，他写道：＂是保持现状还是恢复原来的（发型）”\n\n除了正在参加欧洲杯的亨德森和养伤的阿诺德外，利物浦还有一周就要全队集结了，大家都会回归科克比基地集中。'],"['利物浦', '亚历山大-阿诺德']"
https://dongqiudi.com/articles/2133564.html,（Man United）阳光彩虹小白马曼联官方更...,eeeCstasy,07-09 21:11,"['（Man United）阳光彩虹小白马\n曼联官方更新社交媒体图片并配文，“拉师傅，玩的开心吗？”\nHaving fun there, Marcus?\nManchester United（来源）\nhttps://www.manutd.com/SeeRed（地址）']","['英格兰', '曼联', '拉什福德']"
https://dongqiudi.com/articles/2133563.html,信使报：曼奇尼考虑让托洛伊首发对位斯特林,桐谷爱丽丝,07-09 21:10,"['根据《信使报》的消息，曼奇尼在考虑是否要首发托洛伊，让他对付斯特林。', '在意大利对阵英格兰的首发阵容里，基耶利尼已经做好了准备，而博努奇的膝盖有点小问题，但没什么大碍。', '英格兰队的威胁来自于斯特林，他主要在意大利右后卫迪洛伦佐的那一条边路进攻，而迪洛伦佐也已经表明自己可以胜任左后卫的位置。', '曼奇尼目前唯一的疑问是，是否要安排托洛伊首发担任右后卫对付斯特林，让迪洛伦佐打左后卫的位置。', '曼奇尼喜欢埃莫森的进攻能力，他与迪洛伦佐的搭配在意大利统治局面的情况下没有问题，但如果被压迫得太厉害，那么防守能力更加出色的托洛伊将随时准备代表意大利出场。']","['英格兰', '意大利', '曼城', '亚特兰大', '斯特林', '拉斐尔-托洛伊']"
https://dongqiudi.com/articles/2133559.html,镜报：本-戴维斯希望继续留在利物浦效力,Gambino,07-09 21:08,"['据镜报的消息，本-戴维斯会拒绝凯尔特人和伯恩茅斯，因为他决心留在利物浦。', '自今年2月份从普雷斯顿加盟利物浦以来，本-戴维斯还没有为球队出场，在科纳特加盟以及范戴克、戈麦斯和马蒂普伤愈复出的情况下，本-戴维斯出场的可能性将会降低。', '镜报表示，尽管凯尔特人和伯恩茅斯开出报价，但本-戴维斯依然致力于为利物浦效力。凯尔特人和伯恩茅斯想要租借本-戴维斯，他们在球员去利物浦之前就渴望引进他。', '据悉，本-戴维斯希望在利物浦再试一次，克洛普也告诉他，希望球员能够留下来。本-戴维斯还没有放弃代表利物浦参加英超联赛的希望。', '本-戴维斯一共8次进入利物浦的替补名单，但他因为小腿的伤势在4月份就提前结束赛季。本-戴维斯如今已经痊愈，他会希望在球队开始季前训练的时候证明自己。']","['利物浦', '本-戴维斯']"
https://dongqiudi.com/articles/2133553.html,视频丨当哈里凯恩在加时赛中打进制胜点球后，看看菲...,Laoshu,07-09 21:07,['视频丨当哈里凯恩在加时赛中打进制胜点球后，看看菲尔福登的兴奋状态……'],"['英格兰', '哈里-凯恩', '福登']"
https://dongqiudi.com/articles/2133551.html,这就是想要马伦的原因！,黑白的信仰,07-09 21:06,[],"['多特蒙德', '利物浦', 'PSV埃因霍温', '马伦']"
https://dongqiudi.com/articles/2133550.html,拉瓦内利：英格兰半决赛的点球不存在，我怕冠军已是他们的了,桐谷爱丽丝,07-09 21:06,"['意大利名宿拉瓦内利在接受《Il Mattino》的采访时表示，英格兰对阵丹麦的点球是不存在的，他害怕冠军已经是英格兰人的了。', '“我期待着怎样一场欧洲杯决赛？”拉瓦内利告诉媒体记者：“一场非常小心和专注于控球的比赛，因为双方都会很尊重对方，不会轻视对手。”', '“所以，我觉得会是一场进球很少，但在战术上非常有趣的比赛。在温布利踢球对于意大利来说可能是一个优势，我们有基耶利尼和博努奇这样经验丰富的球员，而对于英格兰人来说，比起对对手的压迫，主场优势反而会导致气氛变得更加压抑。”', '“但实际上，我害怕的是另一件事，那就是害怕决赛开始之前，为英格兰队准备的夺冠庆典就已经摆好了桌子，他们对阵丹麦的那粒点球是不存在的，这是可耻的一幕，更何况当时球场上还有两个球。”']","['英格兰', '意大利', '拉瓦内利']"
https://dongqiudi.com/articles/2133549.html,比利时记者：莱比锡想要曼城前锋恩梅加，转会费约为1000万欧,阿漂,07-09 21:06,"['比利时记者Sacha Tavolieri爆料，上赛季德甲亚军RB莱比锡依然在考虑引进德国U21前锋恩梅加。', '在此之前，莱比锡已经从法兰克福签下了上赛季的德甲银靴安德烈-席尔瓦。', '恩梅加是曼城的球员，上赛季租借效力于比甲球队安德莱赫特，他的转会费将在1000万到1200万欧元之间。']","['曼城', 'RB莱比锡', '恩梅加']"
https://dongqiudi.com/articles/2133544.html,决战欧洲杯-英格兰vs丹麦欧洲杯半决赛乐高重制版,咪咕体育,07-09 21:06,[],"['丹麦', '英格兰']"
https://dongqiudi.com/articles/2133537.html,（espn）地利基耶利尼在接受RAI Sport...,eeeCstasy,07-09 21:03,"['（espn）地利\n基耶利尼在接受RAI Sports采访时谈英格兰进入欧洲杯决赛，\n“英格兰队能进入欧洲杯决赛没啥好惊讶的，因为他们七场比赛中有六场是在主场进行的。”\n""It was predictable England would be in the final of the Euros, as they played six out of seven games on home turf.""\n-Giorgio Chiellini on England reaching the Euro final via RAI Sport\nESPN（来源）\nhttps://plus.espn.com/（地址）']","['尤文图斯', '基耶利尼']"
https://dongqiudi.com/articles/2133530.html,官方：利兹联小将博古什租借加盟伊维萨,波兰足球新闻,07-09 20:59,"['利兹联官方宣布，波兰小将博古什租借加盟伊维萨至本赛季结束。', '现年19岁的博古什曾为利兹联在英冠和联赛杯中出场3次。上赛季他租借为西乙洛格罗涅斯效力，出场23次，其中9次首发，贡献1球1助攻。', '伊维萨上赛季从西乙B附加赛中突围成功，他们将在新赛季征战西乙联赛。', '消息参考来源：利兹联官网', '原文地址：', 'https://www.leedsunited.com/news/team-news/28321/mateusz-bogusz-heads-out-on-loan']","['利兹联', '博古什', '伊维萨']"
https://dongqiudi.com/articles/2133526.html,曼奇尼：英格兰配得上晋级决赛；斯皮是本届欧洲杯最佳左后卫,Brucewhm,07-09 20:58,"['北京时间7月12日3:00，意大利和英格兰将向欧洲杯冠军发起最后的冲击。曼奇尼在接受意大利足协采访时表示，英格兰配得上晋级决赛；斯皮纳佐拉是本届欧洲杯最佳左后卫。', '面对即将到来的决赛，曼奇尼表示：“我认为英格兰配得上晋级决赛，因为他们给对手的机会很少，是一支稳健的球队，我认为这将是一场伟大的决赛。”', '在采访过程中，主持人向曼奇尼展示了几张照片，其中一张照片是意大利在半决赛淘汰西班牙后，因西涅穿着因伤缺阵的斯皮纳佐拉的球衣与队友庆祝晋级。曼奇尼说道：“这是我们在赛后的庆祝，是对斯皮纳佐拉的致意，他是本届欧洲杯最好的左后卫，他不能和我们一起参加决赛真是太遗憾了。他一直都是最出色的，这就是事实。“']","['英格兰', '意大利', '罗马', '斯皮纳佐拉', '曼奇尼']"
https://dongqiudi.com/articles/2133525.html,决战欧洲杯-英格兰赢球后，威廉王子与周围人快乐碰拳,咪咕体育,07-09 20:58,[],['英格兰']
https://dongqiudi.com/articles/2133524.html,决战欧洲杯-当意大利球迷试图混入正在庆贺的英格兰球迷时,咪咕体育,07-09 20:57,[],"['英格兰', '意大利']"
