url,title_list,author_list,time_list,content_list,tag_list
https://dongqiudi.com/articles/2132058.html,罗马诺：那不勒斯主教练斯帕莱蒂有意意大利后卫埃默森,爱看球的小狮子,07-08 22:09,"['据转会专家罗马诺的消息，那不勒斯主教练斯帕莱蒂有意意大利后卫埃莫森。', '斯帕莱蒂在接受采访时被问道了关于埃莫森的转会传闻，他笑着表示：“我不能告诉你我是否有叫他加盟那不勒斯。可能是的，他也许会来吧。”', '上个赛季，埃莫森共代表切尔西出场15次。目前，他正跟随意大利征战欧洲杯，斯皮纳佐拉受伤后，他成为了意大利队的首发左后卫，并在淘汰西班牙的比赛中登场亮相。']","['那不勒斯', '切尔西', '埃莫森', '斯帕莱蒂']"
https://dongqiudi.com/articles/2132047.html,马奎尔晒英格兰全队谢场视频：从没感觉这么爽过,大风车keith,07-08 22:05,"['英格兰队在欧洲杯半决赛中以2-1淘汰丹麦，赛后，中后卫马奎尔晒出了英格兰全队在温布利谢场时的视频，并表示自己从没感觉这么爽过。', '马奎尔在社交媒体上写道：“美妙的时光，从没感觉这么爽过。”', '在伤愈复出后，马奎尔连续4场比赛首发并打满全场，并在对阵乌克兰队的1/4决赛中打进一球。']","['英格兰', '曼联', '马奎尔']"
https://dongqiudi.com/articles/2132048.html,穆帅：我在曼联拿了三冠王，带热刺打进决赛，却被认为是灾难,剪翻足球,07-08 22:01,[],"['曼联', '罗马', '托特纳姆热刺', '穆里尼奥']"
https://dongqiudi.com/articles/2132043.html,足球圣殿 那些关于温布利球场的故事,空空懂球,07-08 22:00,"['在这届泛欧洲化的欧中杯中，遍布多国的联赛承办方式让欧洲杯开启了新的纪元。在所有主办欧洲杯比赛的场地中，位于英国伦敦的温布利球场可谓是本届赛事的中心场地，而在进入半决赛之后，欧洲杯最后的三场对决也将在温布利球场进行。', '作为一座享誉世界的足球圣殿，温布利对于球迷来说并不仅仅是一座球场那样简单，在足球运动发展的一百余年历程中，温布利球场也见证了这项运动从职业化起步到走向鼎盛的整个过程。说起温布利，与足球有关的故事怎么能少，下面笔者将回顾历史带领大家一同重温那些在温布利球场烙下深刻印记的足球故事。', '1923年，落成之后的温布利球场迎来了首场比赛，在那个英伦足球运动职业化的初始阶段，足总杯决赛无疑是全国最受关注的比赛。当年4月28日，原本容量为127000万人的温布利球场迎来了二十四万现场观众，因为看台根本无法容纳下如此数量庞大的球迷，所以很多观赛者站在场边观看了博尔顿与西汉姆联的这场巅峰对决。', '比赛当日，为了维持赛场球迷秩序，骑警斯科雷骑着他的白马BILLY不断的徘徊在球场边缘维持秩序，而在那场激荡人心的对决之后，“白马决赛”和温布利大球场的名字一起载入了足球史册。', '建成之后的温布利球场每每被当做重大比赛的主办场地，同时这座设施完备的宏大球场也被当做了英格兰国家队的主场。1953年，英格兰足球史上第一位绝对意义上的传奇球星斯坦利-马修斯在温布利完成了王者归来的戏份。而在历史的车轮滚滚向前之时，温布利的草皮上也见证了一段又一段绿茵传奇。', '1963年AC米兰用链式防守将本菲卡拉下马、1968年曼联的涅槃重生、上世纪七十年代红军利物浦建立王朝、2011年无敌巴萨登顶欧洲……无数的经典赛事让温布利球场始终与伟大的故事联系一起，而在这其中所有人印象最为深刻的无疑是1966年世界杯和1996年欧洲杯赛事。', '作为两届赛事的主办方，英格兰将当届比赛的氛围烘托到了极点，当1966年英格兰在温布利球场击败西德队最终捧得金杯之时，英格兰足球历史上最为辉煌的一页也就此书写。三十年之后，英格兰虽然没有继续当年的辉煌，但那支才华横溢的三狮军团也让世界为之侧目。而在那届精彩的比赛中，比埃尔霍夫的金球制胜、苏克会拉小提琴的左脚、加斯科因灵光一现以及捷克黄金一代的凌厉都让人至今津津乐道。', '今年夏天，新时代的温布利大球场也将以足球为名继续闪耀历史，而随着新王的诞生，温布利绿茵间的足球传说也将再次拥有崭新的一页。']",['温布利']
https://dongqiudi.com/articles/2132033.html,希望大家多多评价，有不好的一定改正！！都是原创！...,激荡青春,07-08 21:58,['希望大家多多评价，有不好的一定改正！！都是原创！！！谢谢大家[红心][红心][红心]＃你懂设计师不如我'],[]
https://dongqiudi.com/articles/2132031.html,吐槽个球丨说说你眼中的格拉利什________？,Laoshu,07-08 21:57,['吐槽个球丨说说你眼中的格拉利什________？'],"['英格兰', '阿斯顿维拉', '格拉利什']"
https://dongqiudi.com/articles/2132014.html,（espn）尘埃落定对于补时阶段英格兰队的点球，...,eeeCstasy,07-08 21:52,"['（espn）尘埃落定\n对于补时阶段英格兰队的点球，穆里尼奥在接受TalkSPORT采访时表示，\n“这绝不是个点球！特别是在欧洲杯的半决赛这个级别。我看不明白这个判罚。”\n对此，加里·内维尔在接受天空体育采访时表示，\n“就没这么个判法。”\n“不过老实说，我无所谓啦。”\n""It was never a penalty!""\n""Especially at this level, the Semi-Final of a Euro. I don\'t understand the decision.""\n-Jose Mourinho on England\'s penalty via talkSPORT\n""Never a penalty in a million years!""\n""But honestly, I don\'t care.""\n-Gary Neville on England\'s penalty via skysports\nESPN（来源）\nhttps://plus.espn.com/（地址）']","['英格兰', '穆里尼奥', '加里-内维尔']"
https://dongqiudi.com/articles/2131995.html,球场上铁骨铮铮的硬汉迪尼，场下竟然是任人宰割的小...,WFC沃特福德足球俱乐部,07-08 21:39,['球场上铁骨铮铮的硬汉迪尼，场下竟然是任人宰割的小绵羊…'],['沃特福德']
https://dongqiudi.com/articles/2131977.html,英格兰球迷爬上双层巴士庆祝，警察出动维护秩序,切尔西遇上巴萨,07-08 21:29,[],['英格兰']
https://dongqiudi.com/articles/2131962.html,吐槽个球丨终极之战！意大利对阵英格兰，谁将登顶欧...,Laoshu,07-08 21:20,['吐槽个球丨终极之战！意大利对阵英格兰，谁将登顶欧洲之巅？\n\n意大利将参加其第4届欧洲杯决赛，这是德国之后最好的表现；而对手英格兰队则是他们第一次打进欧洲杯决赛！（ESPN消息，不少英格兰球迷已经开始在网上发起请愿，要求在本次欧洲杯英格兰VS意大利的决赛后，放假一天。）'],"['英格兰', '意大利']"
https://dongqiudi.com/articles/2131958.html,沃尔科特：斯特林毫无疑问是本届欧洲杯的最佳球员,Gambino,07-08 21:18,"['斯特林本届欧洲杯为英格兰队表现出色，沃尔科特认为他是赛事的最佳球员。', '谈到斯特林时，沃尔科特说道：“在我看来，他无疑是本届赛事的最佳球员。对阵丹麦队的最后阶段，你们可以看到他还能够像比赛第一分钟那样过掉对手，这说明我们在幕后所做的工作非常正确，比如说体能。”', '“我的儿子和斯特林的儿子来自同一个班，他总是说斯特林又进球了。说真的，我很高兴看到他证明许多人是错误的，他是一名非常棒的球员，也是一个非常棒的人，他配得上所获得的一切。”', '斯特林在本届欧洲杯打进3球，他还送出1次助攻，而英格兰队将在最终的决赛对阵意大利队。']","['英格兰', '曼城', '沃尔科特', '斯特林']"
https://dongqiudi.com/articles/2131957.html,意媒：补强中场，AC米兰会继续尝试从切尔西引进巴卡约科,自赫,07-08 21:18,"['据Milan Reports的消息，AC米兰希望补强球队的中场，他们依然希望能够从切尔西引进巴卡约科。', '此前切尔西队收假，没有大赛任务的队员提前回到了科巴姆，见到了图赫尔，这其中就包括巴卡约科、奇克等队员。', '据悉AC米兰接近拿下吉鲁，吉鲁会首先和切尔西解约，之后和米兰签约，米兰会向切尔西支付一笔数额不大的补偿金。马尔蒂尼希望同切尔西保持良好的关系。或许这个良好的关系是红黑军团有可能签下巴卡约科的基础。', '凯西能否留队，现在依然存疑，据悉凯西要求在新合约中，自己的年薪能够达到600万欧元，到目前为止米兰还没有同意。如果凯西留队，巴卡约科加盟，那么巴卡约科的到来可以加强米兰的阵容厚度，为红黑军团下赛季征战欧冠做准备。如果凯西离队，巴卡约科加盟，那么巴卡约科可以在一定程度上弥补凯西离队造成的缺失，巴卡约科也可以帮助到球队在中场中路的推进。']","['AC米兰', '切尔西', '巴卡约科']"
https://dongqiudi.com/articles/2131951.html,内维尔：决赛拉什福德或者桑乔可能会取代萨卡首发登场,椒盐卤蛋,07-08 21:15,"['加里-内维尔认为欧洲杯决赛对阵意大利，英格兰该派遣桑乔和拉什福德首发，这两人比萨卡更加适合。', '内维尔说：“我同意对阵丹麦把萨卡拿回首发的做法，他和斯特林是边路最活跃的球员，我不确定周日的比赛他是否会首发，但是我觉得这可能对他来说有些不合适。', '“对阵丹麦他的表现以及这届大赛的发挥都非常出色，我只是觉得还能看到其他人的表现。对阵意大利，我们面对的是博努奇、基耶利尼，我想，他们在这块开阔的区域里，不希望看到谁跑位。', '“我觉得肯定是桑乔和拉什福德，他们会跑空间，并且在周日和斯特林一同撕开对手的防线。边路需要速度快的球员，所以我觉得周日的比赛我们不会看到萨卡。这场比赛对他来说太过了，1996年我踢欧洲杯的时候21岁，经历了整届赛事的我感到筋疲力竭。周日的比赛，萨卡会是非常不错的替补，索斯盖特可能会派遣其他人登场。”']","['阿森纳', '英格兰', '多特蒙德', '曼联', '拉什福德', '桑乔', '布卡约-萨卡']"
https://dongqiudi.com/articles/2131943.html,维拉蒂：决赛会由一名伟大的裁判吹罚；英格兰也配得上进决赛,桐谷爱丽丝,07-08 21:10,"['维拉蒂在意大利国家队出席了新闻发布会，他表示不会担心决赛的裁判，而英格兰也配得上进入欧洲杯决赛。', '“我们全队一起看了英格兰打丹麦的半决赛，英格兰有出色的身体素质，他们的球员技术也很出众，他们配得上踢决赛。”', '“恐惧？我不知道，接下来这是一场决赛，我们双方都会想要赢下这场比赛，我们将会对阵一支伟大的球队。英格兰在自己的主场踢比赛，在一座他们非常熟悉的球场踢球，能够在这样的情况下赢下比赛将会是梦想成真。”', '“很多人都已经习惯了这种气氛，这也会给予我们力量。能够在一座宏伟的体育场踢欧洲杯决赛，将会带来很大的激励。”', '“会有一位伟大的裁判吹罚这场比赛，他会领导一场精彩的比赛，不会受到温布利球迷的影响，这些裁判已经习惯于在欧冠和重要的比赛中吹比赛。我们不会感到畏惧。”', '“准备这场比赛很容易，无论谁踢首发，还是踢替补都会为国家队付出自己的生命。决赛的时刻，即使我不希望，但它仍然有可能不会在我们的职业生涯中再次到来。”', '“无需动员，每个人都会为了这场比赛付出100%的力量。有些比赛必须得赢，也想赢，即使从未赢过。”', '“细节将会是决定一切的根本，我们必须专注于比赛，忘记其他的东西。当然有压力，但想要踢得开心、踢得轻松的球队可能会有很大的优势。”', '“这是一个太过于慷慨的点球，如果是我的话，我不会吹的。这是一个重要的进球，让英格兰赢得了比赛，但这是一个过于慷慨的点球。”', '“他太棒了，他每年都证明自己是一位出色的前锋，他正在跟随英格兰踢出一届伟大的欧洲杯。”', '“我们很高兴他们赢得了半决赛，现在我们将会在一场对于双方而言都是历史性的欧洲杯决赛中交手。”', '“我在2012年完成国家队首秀的时候对阵过英格兰，在2014年完成世界杯首秀的时候也对阵了英格兰。这是两支伟大球队之间的比赛，他们也配得上进入决赛。”', '“我们双方都完成了一段伟大的旅程，不幸的是，决赛只有一方能够胜出，我们希望是我们。”', '“这场比赛和对阵西班牙的比赛是不同的比赛。中场是我们可以也必须有所作为的位置，我们必须主导节奏，需要踢出一场精彩的比赛。”', '“英格兰踢的是双中场，他们有两名平衡的中场球员，他们也很重要。而在前场，英格兰也有4名强大又重要的前锋。英格兰很难踢，他们不会给你机会，也不会轻易丢球，每个细节都将决定比赛的走向。”']","['英格兰', '意大利', '巴黎圣日耳曼', '曼城', '斯特林', '维拉蒂']"
https://dongqiudi.com/articles/2131940.html,足球言论丨穆里尼奥：（关于中国足球）我可能不太了...,Laoshu,07-08 21:09,['足球言论丨穆里尼奥：（关于中国足球）我可能不太了解。我之前执教过一位亚洲球员，他是一位顶尖的亚洲球星（孙兴慜）。\n\n作为英超劲旅热刺阵中的前场大将，孙兴慜在上赛季英超联赛中为球队37次，打入了17粒进球的同时送出了10次助攻，打出了职业生涯最为精彩的表现。'],"['罗马', '托特纳姆热刺', '孙兴慜', '穆里尼奥']"
https://dongqiudi.com/articles/2131938.html,英格兰2006年世界杯阵容VS2020欧洲杯主力...,朋Zi远方,07-08 21:07,['英格兰2006年世界杯阵容VS2020欧洲杯主力阵容，虽然2006年英格兰星光熠熠，却没能捧得任何奖杯，如今这支英格兰，却有希望赢得欧洲杯！'],['英格兰']
https://dongqiudi.com/articles/2131937.html,赫伊别尔：希望主裁判谈谈他对于点球判罚的看法,Gambino,07-08 21:07,"['丹麦队与英格兰队的欧洲杯半决赛中，斯特林在加时赛制造点球，赫伊别尔希望主裁判马克列对于这样的判罚做出解释。', '赫伊别尔说道：“从现在开始，你或许会想要让主裁判站在话筒或者镜头之前，这样就可以接受采访了。如果比赛中没有VAR，误判可能发生。不过，如果有VAR，主裁判必须获准在做出判罚后去观看回放，他们有什么感受？他们当时在想什么？他们对于这一切有怎样的看法？”', '“作为球员很容易去回答各种问题，而且不必做出评论，但有时候你会希望听听主裁判的想法。我并不生气，但我们需要正确看待事情。”', '“主裁判的水平非常高，所以，这是我没有对于判罚抱怨的原因。当时我在斯特林附近，我不认为这是一粒点球，因为我认为他踢到了球，然后他在有身体接触之前摔倒了。”', '“不过，这一切发生得太快了，我现在的看法或许是错误的。许多人说这或许不是一粒点球，而且VAR没有介入，这让我很不高兴。我不能评价没有看到的事情，但我希望主裁判在当时做出正确的判罚。”']","['丹麦', '英格兰', '曼城', '托特纳姆热刺', '赫伊别尔', '斯特林']"
https://dongqiudi.com/articles/2131935.html,跟队记者：米兰想用租借+买断的方式签下巴卡约科,椒盐卤蛋,07-08 21:05,"['切尔西跟队记者Nizaar Kinsella消息称，AC米兰已经准备采用租借+买断的方式签下巴卡约科。', 'AC米兰正在努力完成吉鲁的交易，他们希望推动交易的进行，34岁的吉鲁也有离队的欲望。而除了吉鲁，巴卡约科是AC米兰补强中场的首选名单，这名中场同样渴望离开斯坦福桥。对巴卡约科感兴趣的俱乐部除了米兰，还有法甲的尼斯，但是球员希望今年夏天可以加盟AC米兰。', '巴卡约科和切尔西的合约将会在明年夏天到期，米兰希望以尽可能低的转会费签下巴卡约科，并且采取先租后买的买人方式。此外，此前有传闻称，米兰今夏也对齐耶赫感兴趣，但是交易看起来不太可能，因为皮奥利的球队无法承担齐耶赫的转会费和工资。']","['AC米兰', '切尔西', '巴卡约科']"
https://dongqiudi.com/articles/2131930.html,曼晚：曼联买凯恩？他们从热刺买人被拒的经历还少吗？,自赫,07-08 21:03,"['据《曼彻斯特晚报》的消息，曼联想从热刺购买凯恩，但是此前有过很多次的曼联求购热刺队员被拒绝的例子。比如阿尔德韦雷尔德、丹尼-罗斯和戴尔。', '阿尔德韦雷尔德目前仍在热刺效力。2016年夏天，穆里尼奥拿起曼联教鞭，2018年12月份，穆帅从曼联下课。据悉在2018年的夏天，穆帅迫切地希望曼联引进一名中后卫，但是艾德-伍德沃德没有采纳穆帅的建议，两人因此产生了裂痕。彼时在穆帅的中后卫引援候选名单中，就有托比的名字。', '2019年8月，曼联从莱斯特城引进了哈里-马奎尔，这花费了曼联8000万英镑，马奎尔也就此成为了世界足坛中后卫身价第一人。', '曼联也曾追求丹尼-罗斯，今年夏天，罗斯成为了自由身，他加盟了沃特福德。在2017年的12月份，有媒体爆料，曼联希望以5000万英镑的价格引进罗斯，当时引进罗斯正是穆里尼奥的意思。', '在2017年夏天，在穆里尼奥的要求下，曼联尝试引进戴尔，据悉曼联曾一度送上了6000万英镑的报价，然而最终转会同样没有成行。', '在执教曼联期间，穆里尼奥似乎对热刺队员青睐有加。2019年11月，穆里尼奥执教热刺，也许这是合乎他心意的一个选择，2021年4月19日，热刺官方宣布穆里尼奥下课。']","['曼联', '罗马', '托特纳姆热刺', '沃特福德', '阿尔德韦雷尔德', '戴尔', '哈里-凯恩', '穆里尼奥', '丹尼-罗斯']"
https://dongqiudi.com/articles/2131926.html,不满点球判罚，丹麦超模：该给斯特林颁个奥斯卡奖,大风车keith,07-08 21:02,"['丹麦队在欧洲杯半决赛中以1-2不敌英格兰，从而无缘本届赛事决赛。不过，对于斯特林所造的点球，丹麦超模Josephine Skriver在社交媒体上表达了自己的不满。', 'Josephine Skriver写道：“该给斯特林颁个奥斯卡奖。”这名超模还配了呕吐和生气的Emoji表情。', '这场比赛进行到第102分钟时，斯特林在禁区内突破制造了点球，最终凯恩将比分反超。比赛结束后，这粒点球引发了外界的争议。']","['丹麦', '英格兰', '曼城', '斯特林', '剑南春', None, None, None, None, None]"
https://dongqiudi.com/articles/2131904.html,1985年世青赛中国2-0英格兰，高洪波、宫磊斩获进球,蒲师兄,07-08 20:48,[],"['中国', '英格兰']"
https://dongqiudi.com/articles/2131900.html,Boots | Sir Raheem Sterl...,Dr_Football,07-08 20:42,['Boots | Sir Raheem Sterling. \u2063(by ultrafootballau)'],"['英格兰', '曼城', '斯特林']"
https://dongqiudi.com/articles/2131882.html,这就是阿森纳想要本-怀特的原因！,黑白的信仰,07-08 20:27,[],"['阿森纳', '布莱顿', '本-怀特']"
https://dongqiudi.com/articles/2131880.html,决战欧洲杯-为什么英格兰球迷一直在说足球要回家了？,咪咕体育,07-08 20:25,[],['英格兰']
https://dongqiudi.com/articles/2131878.html,决战欧洲杯-三喵认怂了？英格兰球迷表示打不过意大利,咪咕体育,07-08 20:24,[],['英格兰']
https://dongqiudi.com/articles/2131877.html,决战欧洲杯-穆里尼奥谈欧洲杯决赛：这将是场重量级比赛,咪咕体育,07-08 20:24,[],"['英格兰', '意大利', '罗马', '穆里尼奥']"
https://dongqiudi.com/articles/2131874.html,每体：欧洲杯决赛的主裁判将是库伊佩尔斯或德尔塞罗,桀骜丶野心家,07-08 20:18,"['据《每日体育报》报道，欧洲杯决赛意大利vs英格兰的主裁判将是德尔塞罗或者库伊佩尔斯。', '目前，只有库伊佩尔斯和德尔塞罗的裁判组还留在伦敦，《每日体育报》表示，这两名裁判将确认出任欧洲杯决赛的裁判，有待官方确认的只剩谁来当主裁判、谁来当第四官员。', '泰勒等英格兰裁判无法执法欧洲杯决赛，恰克尔、奥萨托等裁判已经回家，而拉奥斯、图尔平等裁判早在小组赛结束后就回国休息了。', '库伊佩尔斯，现年48岁，荷兰名哨，曾执法过2014年欧冠决赛等重大赛事；德尔塞罗，西班牙裁判，45岁，他自小组赛第二轮后还没有获得过执法机会。']","['英格兰', '意大利']"
https://dongqiudi.com/articles/2131857.html,罗体：如果赢得欧洲杯冠军，若日尼奥就有可能赢得金球奖,桐谷爱丽丝,07-08 20:03,"['《罗马体育报》撰文表示，如果赢得欧洲杯冠军，若日尼奥将会有可能赢得金球奖。', '若日尼奥已经在切尔西赢得了本赛季的欧冠冠军，而他现在又随意大利国家队打入了欧洲杯的决赛。', '若日尼奥现在有望完成历史上只有少数人完成的壮举，那就是赢得欧冠冠军之后再赢得欧洲杯冠军，这一双冠的成就将有可能帮助他赢得今年的金球奖。', '《罗马体育报》强调，如果若日尼奥带领意大利夺得欧洲杯冠军，那么他就有可能作为一名中场球员赢得今年的金球奖，就像莫德里奇在2018年时做到的那样。']","['意大利', '切尔西', '若日尼奥']"
https://dongqiudi.com/articles/2131853.html,英格兰难破防，意大利锋线软，各有隐患谁能最终夺冠？,洋葱足坛,07-08 20:00,"['有人说足坛有四大错觉：意大利很弱，英格兰很强，阿根廷能夺冠和国足可以出线。而今年这四大错觉都可以得到验证，意大利英格兰对决温布利问鼎德劳内杯，阿根廷巴西会师美洲杯决赛，国足也入围了亚预赛十二强，争夺世界杯出线名额。', '我们回看本届欧洲杯半决赛，西班牙破门乏力败走半决赛，英格兰运气点球险胜丹麦队，不乏争议时刻也有很多的名场面，让我们回到现场复盘一下球场上到底发生了什么。率先开打的是西班牙和意大利，西班牙变为无锋阵后虽然局势占优但是破门乏术，反倒被意大利率先破门，在派出正印中锋之后很快扳平，但随后对意大利球门的狂轰滥炸却没有一锤定音，直到点球大战进球功臣奥尔莫和莫拉塔双双失点，负于意大利。', '而曼奇尼治下的意大利则更加众志成城，在左路发动机斯皮纳佐拉伤退之后，曼奇尼没有选择变阵，而是让替补埃莫森临危受命担纲左后卫，依然磨合有日的熟练阵型。埃莫森也没有令主帅失望，用不惜体力的奔跑盘活左路，充分缓解了中场和老迈中卫所面临的压力。多纳鲁马的表现也非常出色，正是他的高接抵挡才让看着摇摇欲坠险象环生的意大利球门稳如泰山，并在点球大战中扑出了莫拉塔的关键点球，帮助球队时隔9年再次站上了欧洲杯决赛的舞台。', '英格兰和丹麦的比赛则多了一些戏剧性，面对强大的英格兰，丹麦队并没有龟缩防守，依然坚持效果不错的既定战术，并且在30分钟就利用一粒漂亮的定位球进球获得领先，这对丹麦队可谓是久旱甘霖，全队士气大振，虽然防守时忙中出错，克亚尔打进乌龙球使得比分扳平，但随后的比赛中丹麦队倾尽全力防守，英格兰直到加时赛也没有多少特别好的机会。', '本场的舒梅切尔更是如天神下凡般矗立在丹麦球门前，全场做出9次成功扑救，一次扑点，并且赛后评分最高，这对门将是非常难得的，真是撼山易撼舒梅切尔难。而顶着欧洲杯身价最高阵容最豪华的英格兰本场比赛反而踢得比较别扭，他们再次排出4231的阵容，在中场的防守力度不够，反而多次被丹麦队打进小禁区，皮克福德一直以来在国家队的表现都以稳固准确著称，和俱乐部简直判若两人，但今天的表现实在不能令人满意。直到加时赛103分钟场上的情况起了变化，斯特林在禁区内摔倒，裁判果断指向了12码点，凯恩操刀被舒梅切尔扑出脱手，补射建功，逆转了比分。', '英格兰本场比赛空有58%的控球率，对丹麦球门狂轰20脚，其中10次射正，却仅仅取得了2粒进球，还是乌龙球和点球，4次绝佳机会被错失三次，破密集防守能力非常乏力，而且皮克福德的状态也令人担忧，与之前的精准稳定判若两人，有可能成为决赛上的胜负手。而意大利中后卫上的玄冥二老已经70岁，在面对凯恩、芒特、萨卡、桑乔等年轻球员的轮番冲击时亟需中场球员的支持与保护，但是意大利却没有专职的拖后型防守中场，这将是决赛的重要隐患。']","['英格兰', '意大利']"
