url,title_list,author_list,time_list,content_list,tag_list
https://dongqiudi.com/articles/2129390.html,英格兰半决赛历史盘点：两次倒在点球大战，一次加时遭绝杀,tiamonesta,07-07 16:48,"['英格兰在本届欧洲杯成功晋级半决赛，将在北京时间明天凌晨对阵丹麦。天空体育盘点了英格兰队在大赛（世界杯和欧洲杯）中半决赛的历史。自1966年世界杯之后的55年来，三狮军团都没能进入过大赛决赛。', '英格兰的首次大赛半决赛对阵充满进攻天赋的葡萄牙，双方进行了一场精彩的较量。', '黑豹尤西比奥是有史以来最优秀的球员之一，他与何塞-奥古斯托、何塞-托雷斯、安东尼奥-西蒙斯的四人进攻组合在半决赛之前已经打进了7个进球。', '比赛中英格兰主教练阿尔夫-拉姆齐让诺比-斯蒂尔斯盯防尤西比奥，这个安排奏效了。博比-查尔顿的努力使英格兰队在半小时内领先，随后葡萄牙扳平了比分，最后博比-查尔顿再入一球锁定胜局。', '温布利的九万名观众大声唱到：“哦，当圣徒们进军时”。尤西比奥在走向更衣室时泪流满面。英格兰最终夺得了那届世界杯的冠军。', '英格兰在这场半决赛中被逼到了极限，南斯拉夫从头到尾压制了英格兰。', '比赛的转折点是英格兰球员穆勒里报复南斯拉夫后卫特里维奇被红牌罚下，穆勒里后来说道：“南斯拉夫人整场比赛都在踢我们，这个特里维克是最狠的。他把他的鞋钉从我的小腿上拿下时，血都流了出来，所以我踢了他。”德拉甘-扎伊奇被认为是当时南斯拉夫最好的足球运动员之一，他智胜博比-摩尔，接到长传后攻破了班克斯的大门。', '本场比赛西德首开纪录，布雷默打进了一个非常幸运的任意球折射进球。莱因克尔在比赛还剩9分钟时顽强的扳平了比分。莱因克尔后来透露：“我们已经精疲力尽了。”', '加时赛中，加斯科因获得了一张黄牌，如果晋级决赛他将被停赛，因此他泪流满面。', '英格兰第一次在半决赛中进入了点球大战，但克里斯-瓦德尔和斯图尔特-皮尔斯罚丢了点球，英格兰被淘汰出局。', '在92欧洲杯和94世界杯的惨淡表现后，英格兰队在1996年欧洲杯杀入了四强，这让英国的球迷们振奋起来。', '四分之一决赛英格兰点球大战战胜了西班牙，但半决赛再次遇到了德国。', '焦灼的比赛一直持续到加时赛，加斯科因错过了阿兰-希勒送出的绝妙传中，将比赛拖入了点球大战。', '这次斯图尔特-皮尔斯克服了六年前的心魔，罚入了点球，但索斯盖特却倒在了十二码点上。英格兰的欧洲冠军梦想再一次破碎。', '22年后，索斯盖特率领三狮军团再次站在了半决赛的舞台。', '对手克罗地亚的状态显然非常出色，但看起来这应该是属于英格兰的夜晚，特里皮尔的任意球让他们早早领先，但克罗地亚逐渐控制了比赛，莫德里奇、拉基蒂奇和布罗佐维奇主宰了比赛。佩里西奇在下半场帮助克罗地亚扳平了比分。', '比赛进入了加时，曼朱基奇的绝杀让英格兰球员再次垂头丧气，不过进入四强已经超出了预期。', '这一次，索斯盖特希望通过丹麦的考验，并拿下冠军来完成他对英格兰的救赎。']","['英格兰', '索斯盖特', '皮尔斯', '莱因克尔', '加斯科因', '尤西比奥', '博比-查尔顿']"
https://dongqiudi.com/articles/2129372.html,法媒：相比于萨利巴，马赛主帅桑保利更想要桑托斯后卫佩雷斯,kentish_town,07-07 16:35,"['据法国媒体Le10Sport报道，相比于阿森纳后卫萨利巴，马赛主帅桑保利更想要桑托斯后卫卢安-佩雷斯。', 'The Athletic上周五报道，阿森纳后卫萨利巴选择加盟马赛，只要俱乐部双方达成协议，萨利巴将租借加盟马赛。', '然而，据法国媒体Le10Sport的消息，在萨利巴和巴西桑托斯俱乐部后卫卢安-佩雷斯两者之间，报道声称桑保利更倾向于佩雷斯，由于后者经验更加丰富。此外，马赛和桑托斯就卢安-佩雷斯的转会已进入深入谈判，转会费为450万欧元。', '桑托斯主席Andres Rueda说道：“我们把报价转给了卢安-佩雷斯，对方俱乐部提供了一份报价，我们正在谈判。对于佩雷斯来说，这是份不错的报价。这笔转会有了进展，而且已经处于深入谈判阶段，但还没有完成。”']","['阿森纳', '马赛', '桑托斯', '桑保利', '卢安-佩雷斯', '萨利巴']"
https://dongqiudi.com/articles/2129367.html,你来过，我们都曾记得,南安普顿足球俱乐部,07-07 16:35,['你来过，我们都曾记得'],"['曼联', '南安普顿', '卢克-肖', '沃德-普劳斯']"
https://dongqiudi.com/articles/2129371.html,西意大战赛前，英格兰球迷在看台唱It's Coming Home被狂嘘,开怀一笑,07-07 16:34,[],"['英格兰', '意大利', '西班牙']"
https://dongqiudi.com/articles/2129362.html,队报：贡多齐和萨利巴是好朋友；前者去了马赛，后者也想去,自赫,07-07 16:31,"['据《队报》消息，贡多齐和萨利巴是好朋友，贡多齐去了马赛，这是萨利巴同样想要加盟马赛的一部分原因。', '此前萨利巴拒绝了纽卡、里尔和尼斯，萨利巴认为对于他来说马赛是最佳的去处。', '根据足球网站Goal记者瓦茨(Charles Watts)发布的内容，萨利巴仍然在阿森纳的计划中，下赛季他有可能会留在枪手阵中。', '2021年1月份，阿森纳把萨利巴租借给了尼斯。', '2020-21赛季，萨利巴在法甲中出场20次，打进1球，没有助攻，这20次萨利巴都打满了全场。在法国杯中，萨利巴出场2次，没有进球，没有助攻，累计出场时间为152分钟。', '在青年英超联赛(英超U23联赛)中，萨利巴出场6次，没有进球，没有助攻，累计出场时间为527分钟。在英锦赛中，萨利巴出场2次，没有进球，没有助攻，累计出场时间为179分钟。']","['阿森纳', '马赛', '贡多齐', '萨利巴']"
https://dongqiudi.com/articles/2129355.html,皮亚尼奇会去到热刺吗？,黑白的信仰,07-07 16:28,[],"['托特纳姆热刺', '巴塞罗那', '皮亚尼奇']"
https://dongqiudi.com/articles/2129351.html,切尔西官方晒若日尼奥罚点球照片：冷静如你！,大风车keith,07-07 16:27,"['在意大利对阵西班牙的欧洲杯半决赛中，点球大战中最后出场的若日尼奥稳稳罚进，从而将蓝衣军团送进决赛。赛后，切尔西官方社媒晒出了若日尼奥罚点球时的照片。', '切尔西官方社媒表示：“冷静的若日尼奥。”', '在这场半决赛中，若日尼奥首发出场并打满了120分钟。本届赛事中，这名中场大将几乎踢满了所有比赛，只是在1-0击败威尔士的小组赛中出场74分钟。']","['意大利', '切尔西', '若日尼奥']"
https://dongqiudi.com/articles/2129350.html,欧洲杯为什么没有三四名决赛，你知道吗？,路边足球杰克,07-07 16:26,[],"['丹麦', '英格兰', '西班牙']"
https://dongqiudi.com/articles/2129349.html,J罗会去到AC米兰吗？,黑白的信仰,07-07 16:26,[],"['哥伦比亚', 'AC米兰', '埃弗顿', '哈梅斯-罗德里格斯']"
https://dongqiudi.com/articles/2129344.html,曼城21-22赛季特别版球衣曝光,偶偶足球,07-07 16:22,"['Puma\xa0x\xa0Madchester\xa0Man\xa0City\xa021-22特别版球衣的第一张照片被泄露，显示了出色的外观。据esvaphane报道，彪马将与当地品牌Madchester合作发布两套特别版曼城球衣。', ""Puma\xa0x\xa0Madchester曼城2021-2022年特别版球衣中的第一件，以白色为主，装饰有五颜六色的喷漆全印，结合正面变形的俱乐部队徽和'Mdcr'标志。背面的数字89与俱乐部徽章的风格相似，上面写着Madchester。"", '曼城Puma\xa0x\xa0Madchester球衣将有两种配色。除了白色的，还有一件绿色的（""Thyme""）。关于球衣的设计目前还不知道，但你可以参考下面Madchester的一些作品。', '与本赛季的BALR特别版球衣类似，""Madchester\xa0""球衣将不会在正式比赛中穿着，它更像是生活用品。除了球衣之外，还将有更多产品作为Puma\xa0x\xa0Madchester系列的一部分发布。']",['曼城']
https://dongqiudi.com/articles/2129342.html,罗马诺：若买不到本-怀特，枪手就会去追求塔普索巴,自赫,07-07 16:20,"['据罗马诺的消息，如果说阿森纳买不到本-怀特的话，那么他们会转而求购塔普索巴。', '目前阿森纳在尝试引进本-怀特，但是关于本-怀特的转会费和支付方式，现在阿森纳还没有办法与布莱顿达成一致，如果说没有办法买到本-怀特的话，那么阿森纳会转而去尝试引进塔普索巴。', '在2020-21赛季的英超联赛中，本-怀特出场了36次，没有进球，没有助攻，拿到了3张黄牌，也遇到过1次两黄变一红被罚下的情况，累计的出场时间为3196分钟。本-怀特出场的这36场比赛全部是首发。他的出勤率是非常高的。', '塔普索巴来自布基纳法索，他目前在德甲的勒沃库森踢球。塔普索巴目前22岁，他司职中后卫，身高194cm，惯用脚为右脚。在德国转会市场网上，塔普索巴的预估身价为4000万欧元。', '2020年1月，塔普索巴从吉马良斯转会到了勒沃库森，转会费为1800万欧元。', '到目前为止，塔普索巴在德甲联赛中共计出场了45次，有1粒进球，累计出场时间为3707分钟。']","['阿森纳', '布莱顿', '勒沃库森', '本-怀特', '塔普索巴']"
https://dongqiudi.com/articles/2129336.html,卢克-肖：丹麦有很多战术变化，我们得能适应他们的招数,Spell4,07-07 16:13,"[""北京时间7月7日凌晨，欧洲杯半决赛中英格兰将会在温布利大球场对阵丹麦。赛前，卢克-肖参与英格兰国家队“Lions' Den”节目的采访。"", '“这段旅程很棒，我觉得，尤其是在小组赛阶段之后一切都变得好快。在打德国之前我们还有六天，然后他们说到了淘汰赛的时候就会变很快，确实，比赛一场接着一场。你就只能踢完一场之后赶紧忘记，我们就想最大程度享受比赛，还有一场大赛极其重要，我们就是重新集中注意力，打起精神，做好准备。”', '“训练中我们很乐观，我知道我们状态很好，明天的比赛，你知道，一定会非常壮观，我们就要去到赛场上，享受比赛，做好我们一直以来做的事情。”', '“德国球迷的气氛是我见过的最棒之一，当时感觉全场都坐满了。明天在温布利大球场的半决赛将会有六万观众，我觉得那会更加特别，希望我们能给球迷带来一场精彩的球赛。”', '“我们有很多会议，在这一段时间学习了对手（丹麦），我们看了很多场比赛，所以我们大概了解他们怎么踢球。在战术上他们做得很好，他们在场上有很多变化，所以我们需要为这个做好准备，我们得能适应他们的各种招数。”', '“（最后要说的话就是）放松，保持沉着冷静，准备好应战。”']","['英格兰', '卢克-肖']"
https://dongqiudi.com/articles/2129334.html,阿斯顿维拉国脚中后卫：明斯,任意球专家也是专家,07-07 16:13,['www.YouTube.com'],[]
https://dongqiudi.com/articles/2129321.html,回顾英格兰历届半决赛-12码之殇与绝杀之痛,罗本家的拉小姆,07-07 15:58,"['距离英格兰国家队上一次半决赛取胜，也是唯一一次取胜已经过去了55年，那场比赛他们距离世界杯夺冠仅一步之遥，也让葡萄牙传奇球星尤西比奥伤心落泪。', '1966年世界杯半决赛 英格兰2-1葡萄牙', '这是英格兰第一次进入世界杯的半决赛，对手是坐拥着黑豹之称的尤西比奥的葡萄牙队，这场比赛注定是一场精彩绝伦的好戏。', '尤西比奥是历史上最优秀的球员之一，那届杯赛他与何塞奥古斯托、何塞托雷斯、安东尼奥西莫斯组成的攻击群所向披靡。在打进半决赛之前，尤西比奥已有7球入账。其中有1/4决赛率队5-3逆转战胜朝鲜上演的大四喜。', '英格兰则在8强赛上颇有争议的以1-0击败了阿根廷，上半场阿根廷球员安东尼奥拉廷被罚下使得场面陷入被动，随后阿根廷球员指责主裁判偏袒主队导致了比赛中断，这场比赛之后英、阿足球之间的仇恨由此点燃。', '英格兰主教练阿尔夫拉姆塞用中场铁汉斯泰尔斯充当“镜人”死盯着“黑豹”。头上只有几缕发丝的攻击中场博比·查尔顿大放异彩，一次禁区前沿补射得手，一次接赫斯特回敲抽射破门，葡萄牙仅由尤西比奥点球扳回一分。这粒点球的打进并没有让狂热的英格兰球迷害怕，因为这仅仅是英格兰在本届世界杯上丢的第一球。最终英格兰2-1淘汰葡萄牙进入最后的决赛。赛后，尤西比奥在更衣室里黯然神伤。', '1968年欧洲杯半决赛 南斯拉夫1-0英格兰', '南斯拉夫主教练米蒂奇赛前称：这是10多年以来最好的一支南斯拉夫，他们在8强赛上两回合6-2击败了法国队。', '英格兰赛前球队主力赫斯特和斯泰尔斯伤停不得出战。对于他们来说这将是一场恶战。面对实力强大的南斯拉夫，英格兰队明显难以招架，依靠德拉甘扎伊奇的破门，南斯拉夫1-0淘汰了英格兰队。《卫报》报道说，除了偶尔有点机会外，南斯拉夫占据着场面的绝对主动。', '而导致本场比赛最终走向失利的，还是因为南斯拉夫粗暴的动作。马勒里成为了英格兰国家队历史上第一位被罚下的球员。他报复性地攻击南斯拉夫后卫特里维奇遭到罚下。马勒里后来解释：“南斯拉夫人整场比赛都在踢我们。特里维奇这小子踢得最狠。他的鞋钉划到了我的小腿，血都流出来了，所以我转过身回敬了他。”', '1990年世界杯半决赛 英格兰1-1（点球3-4）西德', '这是英格兰队第一次站在点球大战上，而且也没人能想到在接下来英格兰进行的五次点球大战里面，只有一次获得胜利。', '英格兰在小组赛上直到最后一轮才以1-0险胜埃及得以晋级。淘汰赛的两个对手英格兰均拖到了加时赛。疲惫是英格兰这届杯赛的代名词。', '与西德队的半决赛在第60分钟布雷默完成破门让西德取得领先，随后在第80分钟莱因克尔的进球让双方回到了同一起跑线。最终双方在90分钟之后都没有决出胜负，不得不进入加时赛。“比赛接近尾声时，我们的球员已经是精疲力尽了。”莱茵克尔回忆道。', '当加时赛到来的时候，德国队新派上的替补开始试图改变比赛。体力槽已空使得保罗-加斯科因领到了黄牌，无缘决赛的他在泪水中离开了比赛。', '点球大战，两队都曾击中过门柱。在斯图尔特·皮尔斯和克里斯·瓦尔德罚丢点球后，英格兰被淘汰。', '1996年欧洲杯半决赛 英格兰1-1（点球5-6）德国', '英格兰未能闯进1994年世界杯决赛圈，而在1996年再一次站到了欧洲杯半决赛的舞台上，这使得英格兰球迷格外兴奋。', '两场重磅的小组赛胜利（2-0苏格兰，4-1荷兰）提升了球队的士气也消除了球迷对英格兰“友谊赛之王”的称号。1/4决赛又幸运地通过点球大战击败了西班牙。半决赛遇到老对手德国队，其实英格兰队曾在加时赛还是平局的时候差一点杀死比赛：阿兰希勒低球传中，加斯科因甩出身体抢点却没能把球打进，比赛因此不得不进入到点球大战。', '皮尔斯终结了六年前点球不进的心魔，为英格兰打进点球。然而索斯盖特却成为了本场比赛永远的遗憾，他的点球被科普克挡出。随着穆勒打进了决定性的一球后，英格兰队再次倒在了12码上。', '2018年世界杯半决赛 英格兰1-2克罗地亚', '看起来可能是“英格兰之夜”，特里皮尔精彩的任意球帮助英格兰早早取得领先。但佩里西奇在下半场的进球帮助克罗地亚扳平比分，曼朱基奇在加时赛阶段为克罗地亚打进绝杀球。', '英格兰队曾在特里皮尔进球后有着大把扩大比分的好机会，但克罗地亚依靠着中场莫德里奇、拉基蒂奇和布罗佐维奇的球权控制，让比赛逐渐进入他们的节奏控制，完全压制住了英格兰。虽然这场比赛遗憾落败，但是索斯盖特的建队理念已经深入人心，为2020年欧洲杯打下了坚实的基础。', '这届欧洲杯英格兰队所展现的气质和风貌都是前所未有的，索斯盖特让英格兰队重新找回了自信和信心，这一次他们将在自己的主场捍卫自己的荣誉，拿下第一座欧洲杯冠军奖杯。']","['克罗地亚', '丹麦', '英格兰', '德国', '葡萄牙']"
https://dongqiudi.com/articles/2129320.html,36场，英格兰是从未闯进欧洲杯决赛球队中参赛场次最多的,ETChalmers,07-07 15:57,"['欧洲杯半决赛，英格兰将对阵丹麦，据统计，英格兰已参加了36场欧洲杯比赛，是从未闯进过决赛的球队中场次最多的。', '本届欧洲杯是英格兰队史第10次参赛，在淘汰乌克兰后，三狮军团实现队史第三次闯进欧洲杯半决赛。', '此前两次亮相欧洲杯半决赛，英格兰均未能再进一步，1968年输给南斯拉夫，1996年点球大战不敌德国。', '截至目前，英格兰已参加了36场欧洲杯比赛，是从未闯进决赛的球队中参加场次最多的球队。']",['英格兰']
https://dongqiudi.com/articles/2129318.html,华尔街知名投行高盛 预测英格兰将赢得欧洲杯,咪咕体育,07-07 15:57,[],[]
https://dongqiudi.com/articles/2129312.html,英格兰与丹麦历史交手战绩：英格兰12胜5平4负占据上风,ETChalmers,07-07 15:50,"['北京时间7月8日凌晨，欧洲杯半决赛，英格兰将对阵丹麦，历史交锋方面，两队此前一共交手21次，英格兰取得12胜5平4负，占据上风。', '本届欧洲杯半决赛将是英格兰和丹麦各项赛事第22次交手，此前21次较量，英格兰战绩为12胜5平4负，打入36球，丢20球，占据上风。', '这是两队第三次在大赛舞台相遇，此前两次大赛交手，英格兰战绩为1胜1平，分别是2002年世界杯1/8决赛3-0取胜，1992年欧洲杯小组赛0-0战平。', '两队最近2次交手发生在2020/21赛季的欧国联小组赛，英格兰主客场两回合比赛战绩为1平1负，且1球未进。']","['丹麦', '英格兰']"
https://dongqiudi.com/articles/2129311.html,今晚英格兰对阵丹麦，大家觉得谁会晋级？,七书先生,07-07 15:49,['今晚英格兰对阵丹麦，大家觉得谁会晋级？'],"['丹麦', '英格兰']"
https://dongqiudi.com/articles/2129301.html,外媒：对阿森纳而言，麦迪逊是比奥亚尔更优先的引援选项,自赫,07-07 15:44,"['据TheAFCBell的内容，对于奥亚尔，阿森纳是感兴趣的。', '但是现在阿森纳还没有实质性地去推进引进奥亚尔，阿森纳还没有正式地为奥亚尔送上报价。', '在考虑是不是要购买奥亚尔之前，枪手会首先去考量更为优先的选项。麦迪逊正是枪手的优先选项。', '关于引进麦迪逊的事宜，现在阿森纳也没有什么进展。', '在2020-21赛季的英超联赛中，麦迪逊的发挥还是不错的，在他出场的31场比赛中，英格兰小伙打进了8球，有7次的助攻，平均每打进1球用时为263分钟，累计的出场时间为2105分钟。在欧联杯的比赛中，麦迪逊出场了6次，完成了2球、2助攻，平均每攻入1球用时为173分钟，累计的出场时间为345分钟。', '在2019-20赛季的英超联赛中，麦迪逊出场了31次，打进6球，有3次的助攻，累计的出场时间为2628分钟。在英格兰联赛杯中，麦迪逊出场了5次，打进3球，没有助攻，累计出场时间为367分钟。在当赛季的足总杯中，麦迪逊出场了2次，没有进球，累计的出场时间是96分钟。\xa0', '2020-21赛季法甲联赛，奥亚尔出场了30次，打进7球，有3次助攻，平均每打进1球所用的时间为256分钟，累计的出场时间是1789分钟。在2020-21赛季法国杯的比赛中，奥亚尔出场了3次，打进1球，有1次助攻，累计出场时间为151分钟。', '2019-20赛季法甲，奥亚尔出场25次，打进3球，有3次助攻，累计出场时间为1963分钟。在当赛季欧冠中，奥亚尔出场8次，打进1球，送出了6次的助攻，展示了很好的效率，累计出场时间为715分钟。在2019-20赛季法国联赛杯的比赛中，奥亚尔出场4次，打进2球，送出1次助攻，累计出场时间为301分钟，在法国杯的比赛中，奥亚尔出场4次，打进3球，累计出场时间为276分钟。']","['阿森纳', '里昂', '莱斯特城', '麦迪逊', '奥亚尔']"
https://dongqiudi.com/articles/2129295.html,天空体育：新加坡一男子因向英超球员发送辱骂信息而被逮捕,快乐的大金毛,07-07 15:40,"['根据《天空体育》的消息，新加坡一名19岁男子因为向布莱顿前锋莫派发送侮辱性信息而被逮捕。', '新加坡男子Derek Ng在社交媒体上向莫派发送包含死亡威胁的侮辱性信息。在遭到举报之后，该男子受到了英超联赛和新加坡当局的调查，最终该男子被逮捕并判刑。他成为第一个英国以外因辱骂球员而被定罪的人。', '英超联赛于2020年6月推出了辱骂信息在线举报系统，以便球员、主教练及他们的家人可以在社交媒体上收到辱骂时进行举报。', '莫派目前效力于英超布莱顿队。他在上赛季联赛倒数第三轮中，因为辱骂裁判而被停赛三场，无缘最后两轮比赛，提前结束赛季。']","['布莱顿', '莫派']"
https://dongqiudi.com/articles/2129293.html,英格兰vs丹麦身价对比：英格兰12.6亿欧，是对方的4倍,ETChalmers,07-07 15:38,"['北京时间7月8日凌晨，欧洲杯半决赛，英格兰将对阵丹麦，双方阵容总身价方面，英格兰多达12.6亿欧，是对方的4倍，丹麦仅3.1亿欧。', '据德国转会市场网站显示，英格兰阵容总身价为12.6亿欧，是本届欧洲杯24强中最高的，其中身价最高的凯恩，这位热刺前锋的市场身价高达1.2亿欧。而丹麦总身价为3.1亿欧，身价最高的是提前告别本届欧洲杯的埃里克森，他的身价为4000万欧。', '双方阵容平均年龄方面，英格兰为25.2岁，是本届欧洲杯24强中第二年轻的，而丹麦的平均年龄为27.7岁。']","['丹麦', '英格兰']"
https://dongqiudi.com/articles/2129288.html,贝尼特斯晒季前训练照：重回英超了！,大风车keith,07-07 15:34,"['日前，埃弗顿新任主帅贝尼特斯在社交媒体上晒出了球队季前备战的照片，并发文感慨自己再次回到了英超执教。', '贝尼特斯写道：“重回英超了！”照片中，这名西班牙教头正与助手以及球员们沟通，他的心情看上去也不错。', '执教生涯中，贝尼特斯曾先后在利物浦、切尔西和纽卡斯尔联等英超球队执教，他也成为史上第二位执教过利物浦和埃弗顿的教头。']","['埃弗顿', '贝尼特斯']"
https://dongqiudi.com/articles/2129280.html,佩蒂特：蓝军需要一位顶级前锋，哈兰德就是答案,切尔西遇上巴萨,07-07 15:24,"['据每日邮报报道，前蓝军中场佩蒂特认为切尔西应该尽全力签下哈兰德。', '佩蒂特说道：“签前锋这件事很简单，因为吉鲁会离队，亚伯拉罕很可能被外租，维尔纳在得分能力上有些欠缺，另外，哈弗茨也不是前锋。”', '“切尔西需要一个前锋，尤其是一个得分能力超强的前锋。哈兰德就是他们的答案，他强壮有力，年轻有为，未来一片光明。图赫尔可以在这笔转会中扮演一个关键角色，他可以吸引哈兰德加盟。”', '“在进攻端，他可以成为切尔西真正的终结者。我可以想象他与芒特、哈弗茨、普利西奇和齐耶赫的联动，他们能帮助哈兰德在斯坦福桥打进很多球，切尔西需要一个顶级前锋，就是这么简单。”', '新闻源｜https://www.dailymail.co.uk/sport/football/article-9758905/Erling-Haaland-answer-Emmanuel-Petit-urges-Chelsea-sign-Borussia-Dortmund-striking-star.html']","['多特蒙德', '切尔西', '佩蒂特', '哈兰德']"
